id,location_id,title,location,start_date,start_time,end_date,end_time
5009,347,Freddie For A Day,Hard Rock Cafe,2016-09-05,19:00,2016-09-05,19:00
5010,188,"FUEGO | ""Summer Bomb""",Aurora Beach,2016-08-17,20:00,2016-08-17,20:00
4998,5003,Senesino a Venezia,Palazzo Pisani Moretta,2016-09-06,18:30,2016-09-06,18:30
4996,330,73. Mostra Internazionale d’Arte Cinematografica,Palazzo del Cinema,2016-08-30,18:30,2016-09-10,7:00
4994,4993,Vespri per l'Assunta,Basilica di Santa Maria della Salute,2016-08-14,13:30,2016-08-14,13:30
4991,3122,PicNic del Rondò,Calle Corte Legrenzi,2016-08-11,16:30,2016-08-11,16:30
4989,"230, 131, 3198, 37, 231",Ferragosto: Apertura straordinaria musei e siti archeologici statali,"Museo Archeologico Nazionale, Gallerie dell'Accademia, Galleria Giorgio Franchetti alla Ca' d'Oro, Museo d'Arte Orientale, Palazzo Grimani",2016-08-15,6:15,2016-08-15,6:15
4990,36,Tsunemasa,Teatro Stabile del Veneto Carlo Goldoni,2016-09-18,18:00,2016-09-18,18:00
4981,2117,Artigiani a Rialto in Pescheria Grande,Pescheria di Rialto,2016-09-04,9:00,2016-09-04,9:00
4982,1511,Creativo sarai tu!,Punta della Dogana,2016-09-17,13:00,2016-09-17,13:00
4983,36,"Herr Goethe, stanza singola vista Laguna",Teatro Stabile del Veneto Carlo Goldoni,2016-09-28,18:00,2016-09-28,18:00
4984,36,Joy Singers & Love songs,Teatro Stabile del Veneto Carlo Goldoni,2017-02-14,20:00,2017-02-14,20:00
4985,36,Omaggio a Pino Donaggio,Teatro Stabile del Veneto Carlo Goldoni,2016-10-15,18:30,2016-10-15,18:30
4986,36,Romeo e Giulietta L’amore è saltimbanco - Teatro Stabile del Veneto,Teatro Stabile del Veneto Carlo Goldoni,2016-12-31,20:00,2017-01-01,16:00
4968,3900,Veneziani a Würzburg,Palazzo Marin,2016-09-02,18:30,2016-09-02,18:30
4970,1170,Teti Cortese,F30,2016-08-13,19:00,2016-08-13,19:00
4971,4872,Trevor Brown e Maya Petrovna,Awai,2016-08-11,17:00,2016-08-11,17:00
4972,1170,Tricordi,F30,2016-08-20,19:00,2016-08-20,19:00
4974,1170,Black Coffee,F30,2016-08-27,19:00,2016-08-27,19:00
4975,3716,Concorso internazionale di poesia Altino,Museo Archeologico Nazionale di Altino,2016-09-03,16:00,2016-09-03,16:00
4964,2334,"Barridas, Sacadas e Ganchos | 3 tecniche di Tango",Studio Tango,2016-08-14,17:00,2016-08-28,17:00
4958,19,Una conversazione con Vivica Genaux,"Ateneo Veneto di Scienze, Lettere ed Arti",2016-08-30,16:30,2016-08-30,16:30
4961,188,Fuego | Hip Hop/R&B/Reggaeton,Aurora Beach,2016-08-10,20:00,2016-08-10,20:00
4953,1860,Irene Guglielmi Band,Hotel Bauer,2016-08-26,17:00,2016-08-26,17:00
4954,1860,Accordi Disaccordi,Hotel Bauer,2016-09-23,17:00,2016-09-23,17:00
4955,1860,A B A,Hotel Bauer,2016-09-16,17:00,2016-09-16,17:00
4956,1860,The One Beat Band,Hotel Bauer,2016-08-12,17:00,2016-08-12,17:00
4957,1860,The Way Back,Hotel Bauer,2016-08-19,17:00,2016-08-19,17:00
4947,4704,Music on the Top - Tutti i Mercoledì,Hotel Carlton On The Grand Canal,2016-08-03,18:00,2016-08-31,18:00
4949,347,PIXIE ROCKS,Hard Rock Cafe,2016-08-03,13:00,2016-08-03,13:00
4944,2086,Due di picche letterari,Biblioteca Civica di Mestre Villa Erizzo | VEZ,2016-08-31,19:00,2016-08-31,19:00
4942,4941,"Sagra di S.Stefano, Portosecco","Chiesa Santo Stefano, Portosecco",2016-08-11,19:30,2016-09-11,8:00
4937,211,Apertura straordinaria della mostra Helmut Newton,Casa dei Tre Oci,2016-08-05,16:00,2016-08-07,8:00
4938,133,Città di Campi,Teatrino Groggia,2016-08-04,16:00,2016-08-04,16:00
4939,"141, 315",L'chaim! Cultura e golosità kasher,"Campo del Ghetto Novo, Museo Ebraico",2016-10-05,8:00,2016-11-13,9:00
4933,33,Norma di Bellini,Teatro La Fenice,2016-08-27,17:00,2016-09-18,13:30
4934,4940,L’apoteosi della musica tra Ospedali e Conservatori,Palazzo Zorzi - Unesco,2016-08-27,18:30,2016-08-27,18:30
4932,4872,Monica Giordano,Awai,2016-08-02,17:00,2016-08-02,17:00
4925,344,“L’eroe delle memorie” di Elena Cristina Boţan−Potop,Istituto Romeno di Venezia,2016-08-02,16:30,2016-08-02,16:30
4927,282,Omaggio a Jean-Paul Belmondo,Teatrino di Palazzo Grassi,2016-09-09,14:00,2016-09-09,14:00
4924,365,The Monster Show Jane Beckwith,Scuola Internazionale di Grafica,2016-07-29,13:00,2016-07-29,13:00
4923,3517,Sagra di Santa Marta,Campetto da Basket di Santa Marta,2016-07-29,16:00,2016-07-31,16:00
4917,188,"FUEGO | ""White Touch""",Aurora Beach,2016-08-03,20:00,2016-08-03,20:00
4912,2154,Milonga sui tetti: Rooftop,Hotel Saturnia & International ,2016-08-28,17:30,2016-08-28,17:30
4914,33,Giuseppe Verdi: Attila,Teatro La Fenice,2016-12-09,18:00,2016-12-17,14:30
4909,231,"Ll'uso dei marmi antichi nei camini, nei pavimenti e alle pareti delle stanze di Palazzo Grimani",Palazzo Grimani,2016-07-28,15:00,2016-07-28,15:00
4910,36,Omaggio a Cesco Baseggio A 120 anni dalla nascita,Teatro Stabile del Veneto Carlo Goldoni,2017-04-13,14:00,2017-04-13,14:00
4903,"23, 335",Biennale Teatro 2016 | 14 agosto,"Teatro Piccolo Arsenale, Biennale - Arsenale ",2016-08-14,14:00,2016-08-14,14:00
4902,"23, 25",Biennale Teatro 2016 | 13 agosto,"Teatro Piccolo Arsenale, Teatro alle Tese",2016-08-13,14:00,2016-08-13,14:00
4901,"23, 335",Biennale Teatro 2016 | 12 agosto,"Teatro Piccolo Arsenale, Biennale - Arsenale ",2016-08-12,14:00,2016-08-12,14:00
4900,"23, 25",Biennale Teatro 2016 | 11 agosto,"Teatro Piccolo Arsenale, Teatro alle Tese",2016-08-11,14:00,2016-08-11,14:00
4899,"23, 33",Biennale teatro 2016 | 10 agosto,"Teatro Piccolo Arsenale, Teatro La Fenice",2016-08-10,13:00,2016-08-10,13:00
4898,"23, 25",Biennale Teatro 2016 | 9 agosto,"Teatro Piccolo Arsenale, Teatro alle Tese",2016-08-09,14:00,2016-08-09,14:00
4897,23,Biennale Teatro 2016 | 8 agosto,Teatro Piccolo Arsenale,2016-08-08,14:00,2016-08-08,14:00
4888,224,Giovedì sotto le Stelle,Casinò di Venezia - Ca' Vendramin Calergi,2016-07-28,17:30,2016-08-04,17:30
4889,3237,Mercatino dei Granai,Mercatino dei Granai,2016-09-18,8:30,2016-09-18,8:30
4890,36,"Big Vocal Orchestra ""A Big Christmas""",Teatro Stabile del Veneto Carlo Goldoni,2016-12-17,20:00,2016-12-18,20:00
4891,36,Lezioni di Rock David Bowie,Teatro Stabile del Veneto Carlo Goldoni,2017-01-10,19:30,2017-01-10,19:30
4892,36,Lezioni di Rock Prince - Teatro Stabile del Veneto,Teatro Stabile del Veneto Carlo Goldoni,2017-03-16,19:30,2017-03-16,19:30
4893,36,STOMP,Teatro Stabile del Veneto Carlo Goldoni,2017-05-23,18:30,2017-05-28,14:00
4894,33,Vocal Skyline,Teatro La Fenice,2017-04-15,19:00,2017-04-15,19:00
4887,"23, 335",Biennale Teatro 2016 | 7 agosto,"Teatro Piccolo Arsenale, Biennale - Arsenale ",2016-08-07,14:00,2016-08-07,14:00
4886,"23, 25",Biennale Teatro 2016 | 6 agosto,"Teatro Piccolo Arsenale, Teatro alle Tese",2016-08-06,14:00,2016-08-06,14:00
4885,"23, 33",Biennale Teatro 2016 | 5 agosto,"Teatro Piccolo Arsenale, Teatro La Fenice",2016-08-05,14:00,2016-08-05,14:00
4884,"23, 25",BIENNALE TEATRO 2016 | 4 agosto,"Teatro Piccolo Arsenale, Teatro alle Tese",2016-08-04,14:00,2016-08-04,14:00
4883,"23, 335",Biennale Teatro 2016 | 3 agosto,"Teatro Piccolo Arsenale, Biennale - Arsenale ",2016-08-03,14:00,2016-08-03,14:00
4882,"23, 25",Biennale Teatro 2016 | 2 agosto,"Teatro Piccolo Arsenale, Teatro alle Tese",2016-08-02,14:00,2016-08-02,14:00
4881,"23, 161",Biennale Teatro 2016 | 1 agosto,"Teatro Piccolo Arsenale, Vega Parco Scientifico Tecnologico di Venezia",2016-08-01,14:00,2016-08-01,14:00
4880,"23, 335",Biennale Teatro 2016 | 31 luglio,"Teatro Piccolo Arsenale, Biennale - Arsenale ",2016-07-31,14:00,2016-07-31,14:00
4879,"23, 25",Biennale Teatro 2016 | 30 luglio,"Teatro Piccolo Arsenale, Teatro alle Tese",2016-07-30,14:00,2016-07-30,14:00
4877,181,Notes from the Ghetto,Isola di San Servolo,2016-07-25,17:00,2016-07-25,17:00
4878,188,"FUEGO | ""ColorFLUO""",Aurora Beach,2016-07-27,20:00,2016-07-27,20:00
4876,24,Biennale Teatro 2016 | 29 luglio,Ca' Giustinian,2016-07-29,16:00,2016-07-29,16:00
4875,"23, 25, 161",Biennale Teatro 2016 | 28 luglio,"Teatro Piccolo Arsenale, Teatro alle Tese, Vega Parco Scientifico Tecnologico di Venezia",2016-07-28,14:00,2016-07-28,14:00
4874,"23, 161",Biennale Teatro 2016 | 27 luglio,"Teatro Piccolo Arsenale, Vega Parco Scientifico Tecnologico di Venezia",2016-07-27,14:00,2016-07-27,14:00
4873,161,Biennale Teatro 2016 | 26 luglio,Vega Parco Scientifico Tecnologico di Venezia,2016-07-26,19:00,2016-07-26,19:00
4866,"120, 4867, 4868",Tango in Campo 2016,"Campo San Giacomo dall'Orio, Campo San Tomà, Chiosco da Giosia",2016-07-21,19:00,2016-10-04,19:00
4863,35,"""Ossessione Vezzoli""",Palazzo Grassi,2016-09-01,17:00,2016-09-01,17:00
4860,4872,Los Companeros + Collettivo Coyote,Awai,2016-07-24,16:00,2016-07-24,16:00
4852,4905,"""Ultraje"" di Rossy Evelin Lima",Orient Experience,2016-08-01,14:00,2016-08-01,14:00
4853,188,Ferragosto BEACH PARTY,Aurora Beach,2016-08-14,20:00,2016-08-14,20:00
4855,4904,Santas y matriarcas,"""LE VIE"" - Cooperativa Sociale Qualità",2016-07-27,17:30,2016-07-27,17:30
4844,1476,"Due appuntamenti da non perdere: 19 luglio, Shakespeare in Venice Summer School",Fondazione Giorgio Cini,2016-07-19,13:30,2016-07-19,16:00
4845,224,"Casinò di Venezia ♦ ""Giovedì sotto le Stelle"" ♦ 21 Luglio",Casinò di Venezia - Ca' Vendramin Calergi,2016-07-21,17:30,2016-07-21,17:30
4840,188,"FUEGO | ""Lemon Card Party""",Aurora Beach,2016-07-20,19:30,2016-07-20,19:30
4801,4804,Festa del Redentore a Favaro Veneto,Centro Sportivo di Favaro Veneto,2016-07-15,14:00,2016-07-17,14:30
4792,1620,Riccardo Guarnieri e Silvano Tessarollo,Galleria Michela Rizzo,2016-07-15,16:30,2016-07-15,16:30
4793,15,Incontri dedicati alla letteratura per l'infanzia,Fondazione Querini Stampalia,2016-10-08,8:00,2016-11-13,9:00
4798,36,Romeo e Giulietta,Teatro Stabile del Veneto Carlo Goldoni,2017-01-20,19:30,2017-01-20,19:30
4782,33,"DORIAN GRAY, La bellezza non ha pietà",Teatro La Fenice,2016-08-06,18:00,2016-08-07,18:00
4783,141,Il Mercante di Venezia,Campo del Ghetto Novo,2016-07-26,18:30,2016-08-01,18:30
4784,267,Musica Sacra - Festa del Redentore,Chiesa del Santissimo Redentore,2016-07-15,18:30,2016-07-15,18:30
4785,108,Chick Corea Quintet,Fondazione Emilio ed Annabianca Vedova,2016-07-14,19:00,2016-07-15,19:00
4786,33,Gaetano Donizetti: L'Elisir d'amore,Teatro La Fenice,2016-08-26,17:00,2016-10-09,13:30
4787,4802,Venezia al tempo del muto,Grande Albergo Ausonia & Hungaria,2016-07-15,19:00,2016-07-15,19:00
4789,287,The Epistemology of Border by Avenir Institute,Teatro Marinoni,2016-07-15,11:00,2016-07-15,11:00
4790,3900,Cocktail | Vivaldi senza la parrucca,Palazzo Marin,2016-07-15,17:00,2016-07-15,17:00
4791,1620,People at an exhibition,Galleria Michela Rizzo,2016-07-22,16:30,2016-07-22,16:30
4781,1750,Tommaso Dognazzi,Palazzo Flangini,2016-07-15,16:00,2016-07-15,16:00
4775,3361,Pallastrada,Ruotaliberatutti,2016-07-12,17:30,2016-07-12,17:30
4777,186,Balli in Campo alla Zattere,Stazione Marittima Venezia,2016-07-11,19:00,2016-07-11,19:00
4778,4779,Jason&Becky,Casa dell'Ospitalità - Sede di S. Alvise,2016-07-13,16:00,2016-07-13,16:00
4766,1247,"Matteo Sansonetto Blues Revue feat. James ""Boogaloo"" Bolden",Il Paradiso Perduto,2016-07-11,18:30,2016-07-11,18:30
4767,230,Estate al Museo Junior,Museo Archeologico Nazionale,2016-07-12,7:30,2016-08-24,7:30
4772,224,Giovedì sotto le Stelle,Casinò di Venezia - Ca' Vendramin Calergi,2016-07-14,17:30,2016-07-14,17:30
4774,36,Diana & Lady D,Teatro Stabile del Veneto Carlo Goldoni,2017-04-08,18:30,2017-04-09,14:00
4755,188,Fuego,Aurora Beach,2016-07-13,19:30,2016-07-13,19:30
4756,310,Il Giardino Stregato Di Maga Cornacchia,Ca' Corner (de la Ca' Granda),2016-07-12,19:15,2016-07-12,19:15
4757,4338,Concerto per il SS. Redentore,Chiesa dei Tolentini,2016-07-23,14:30,2016-07-23,14:30
4758,211,Redentore alla casa dei Tre Oci,Casa dei Tre Oci,2016-07-16,17:00,2016-07-16,17:00
4759,1476,Towards a Conjunction of Ethnographic and Historiographic Perspectives,Fondazione Giorgio Cini,2016-07-08,12:30,2016-07-10,7:00
4749,1513,Emozioni per un cambiamento,Palazzo Albrizzi - Capello,2016-07-09,18:00,2016-07-09,18:00
4750,111,Concerto per Anniversario della Fondazione della Pietà 1346-2016,Chiesa di San Francesco della Vigna,2016-07-18,14:30,2016-07-18,14:30
4751,4,Concerto d’Estate - Mozart e Puccini ai Frari,Basilica di Santa Maria Gloriosa dei Frari,2016-07-29,18:30,2016-07-29,18:30
4753,188,Aurora Beach,Aurora Beach,2016-07-09,17:00,2016-07-09,17:00
4748,120,Festa di San Giacomo da l'Orio,Campo San Giacomo dall'Orio,2016-07-14,19:00,2016-07-23,19:00
4742,318,Intuitive Music & More with Electronics,Forte Marghera - Parco del Contemporaneo,2016-07-13,19:00,2016-07-13,19:00
4736,15,La notte famosissima,Fondazione Querini Stampalia,2016-07-13,16:00,2016-07-13,16:00
4737,231,Il Rinascimento a Venezia,Palazzo Grimani,2016-07-07,15:00,2016-07-07,15:00
4738,4740,"""IL SARTO"" | Aperitivo navigante d'autore",Campo San Vio,2016-07-10,17:00,2016-07-10,17:00
4718,3361,Sunset Ride,Ruotaliberatutti,2016-07-08,17:30,2016-07-08,17:30
4719,1860,Karen Edwards,Hotel Bauer,2016-07-15,17:00,2016-07-15,17:00
4720,1860,Shanna Waterstown,Hotel Bauer,2016-07-29,17:00,2016-07-29,17:00
4721,"4726, 1511, 114, 1459, 4728, 282, 36, 2, 252",Venezia Jazz Festival IX edizione,"Latteria2465, Punta della Dogana, Chiesa della Pietà, Splendid Venice Hotel, Campo San Samuele, Teatrino di Palazzo Grassi, Teatro Stabile del Veneto Carlo Goldoni, Conservatorio di Musica ""Benedetto Marcello"", Peggy Guggenheim Collection",2016-07-03,19:30,2016-07-22,18:00
4722,1860,Joe Magnarelli,Hotel Bauer,2016-07-22,17:00,2016-07-22,17:00
4723,4665,Neverland I w/ OYADI, Empire Space Building,2016-07-09,21:00,2016-07-09,21:00
4724,198,Visite alla Scuola Grande San Giovanni Evangelista,Scuola Grande di San Giovanni Evangelista,2016-07-22,13:00,2016-07-29,13:00
4725,1860,Chenai,Hotel Bauer,2016-08-05,17:00,2016-08-05,17:00
4711,224,Giovedì sotto le Stelle,Casinò di Venezia - Ca' Vendramin Calergi,2016-07-07,17:30,2016-07-07,17:30
4712,234,Educazione affettiva,Centro Culturale Kolbe,2016-07-28,19:30,2016-07-28,19:30
4713,1170,I Rimorchiatori,F30,2016-07-30,19:00,2016-07-30,19:00
4714,1170,Francesca Viaro Duo,F30,2016-07-09,19:00,2016-07-09,19:00
4715,1608,"""Pericolo Giallo"" di Fulvio Ervas",Libreria MarcoPolo - Campo S. Margherita,2016-07-08,19:00,2016-07-08,19:00
4716,1170,The Ghostway Trio,F30,2016-07-23,19:00,2016-07-23,19:00
4707,33,Concerto per le carcerate,Teatro La Fenice,2016-07-03,19:00,2016-07-03,19:00
4708,1278,Arnauld Brejon de Lavargnée | Una rivalutazione della pittura veneziana del Seicento,Palazzo Franchetti,2016-07-06,16:00,2016-07-06,16:00
4709,211,Aperitivo Fotografico ai Tre Oci,Casa dei Tre Oci,2016-07-13,16:30,2016-07-27,17:00
4710,188,"FUEGO | ""Traffic Light Party""",Aurora Beach,2016-07-06,19:30,2016-07-06,19:30
4672,231,Festa dei Musei a Palazzo Grimani,Palazzo Grimani,2016-07-02,12:30,2016-07-03,6:15
4673,37,"Festa dei Musei ""Enrico di Borbone, un globetrotter di fine ottocento""",Museo d'Arte Orientale,2016-07-02,8:30,2016-07-02,9:30
4675,1665,Incontro di Bioenergetica in Gruppo,Flat,2016-07-07,17:30,2016-07-07,17:30
4676,4702,Redentore 2016 - electronic music party,"Aeroporto ""Giovanni Nicelli""",2016-07-16,20:00,2016-07-16,20:00
4677,131,Venezia si racconta alle Gallerie dell'Accademia,Gallerie dell'Accademia,2016-07-02,8:00,2016-07-02,8:00
4678,4704,Al Fresco Jazz,Hotel Carlton On The Grand Canal,2016-07-06,18:00,2016-07-27,18:00
4682,36,Anelante,Teatro Stabile del Veneto Carlo Goldoni,2017-03-17,19:30,2017-03-18,18:00
4683,36,Calendar girls,Teatro Stabile del Veneto Carlo Goldoni,2016-12-08,19:30,2016-12-11,15:00
4684,36,Entremeses,Teatro Stabile del Veneto Carlo Goldoni,2016-12-03,18:00,2016-12-04,15:00
4685,36,Fedra,Teatro Stabile del Veneto Carlo Goldoni,2017-03-22,19:30,2017-03-26,18:30
4686,36,Giulio Cesare,Teatro Stabile del Veneto Carlo Goldoni,2016-10-26,18:30,2016-10-30,15:00
4687,36,Il bagno,Teatro Stabile del Veneto Carlo Goldoni,2017-03-04,19:30,2017-03-05,15:00
4688,36,Il deserto dei Tartari,Teatro Stabile del Veneto Carlo Goldoni,2016-11-23,19:30,2016-11-27,15:00
4689,36,La locandiera,Teatro Stabile del Veneto Carlo Goldoni,2016-11-17,19:30,2016-11-20,15:00
4690,36,Le donne gelose,Teatro Stabile del Veneto Carlo Goldoni,2017-01-26,19:30,2017-01-29,15:00
4693,36,Locandiera B&B,Teatro Stabile del Veneto Carlo Goldoni,2017-02-02,19:30,2017-02-04,19:30
4694,36,Macbeth,Teatro Stabile del Veneto Carlo Goldoni,2017-02-08,19:30,2017-02-12,15:00
4695,36,Molière: la recita di Versailles,Teatro Stabile del Veneto Carlo Goldoni,2017-02-18,18:00,2017-02-19,15:00
4696,36,Mr. Puntila e il suo servo Matti,Teatro Stabile del Veneto Carlo Goldoni,2017-03-09,19:30,2017-03-12,15:00
4697,36,Performance,Teatro Stabile del Veneto Carlo Goldoni,2016-11-12,18:00,2016-11-13,15:00
4698,36,Porcile,Teatro Stabile del Veneto Carlo Goldoni,2017-03-30,18:30,2017-04-02,18:30
4699,36,Spirito allegro,Teatro Stabile del Veneto Carlo Goldoni,2017-01-12,19:30,2017-01-13,19:30
4700,36,The merchant of Venice,Teatro Stabile del Veneto Carlo Goldoni,2016-10-19,18:30,2016-10-21,18:30
4701,36,TONI SARTANA e le streghe di Bagdàd,Teatro Stabile del Veneto Carlo Goldoni,2017-04-19,18:30,2017-04-23,14:00
4668,36,Teatro Goldoni | Presentazione stagione 2016-2017,Teatro Stabile del Veneto Carlo Goldoni,2016-06-30,15:30,2016-06-30,15:30
4667,216,W.A.Ve,IUAV Cotonificio Veneziano,2016-06-28,7:00,2016-07-04,17:30
4661,192,Festa del Redentore,Bacino di San Marco,2016-07-16,17:00,2016-07-17,14:00
4662,3716,Festa dei Musei I Altino,Museo Archeologico Nazionale di Altino,2016-07-02,8:00,2016-07-03,14:00
4663,315,"Tour del Ghetto, cultura e golosità kosher",Museo Ebraico,2016-07-03,14:45,2016-07-24,14:45
4664,4665,Fabio Ferrara, Empire Space Building,2016-07-02,21:00,2016-07-02,21:00
4650,33,Risonanze,Teatro La Fenice,2016-07-03,17:00,2016-07-03,17:00
4651,33,Maratona Contemporanea,Teatro La Fenice,2016-07-06,13:00,2016-07-06,13:00
4652,33,Nazzareno Carusi,Teatro La Fenice,2016-07-13,18:00,2016-07-13,18:00
4653,33,Alberto Ferro pianoforte,Teatro La Fenice,2016-07-14,15:00,2016-07-14,15:00
4654,33,Venice Music Master,Teatro La Fenice,2016-07-17,18:00,2016-07-17,18:00
4656,2,Erik Satie,"Conservatorio di Musica ""Benedetto Marcello""",2016-07-02,9:00,2016-07-02,15:00
4659,3361,Soundbike,Ruotaliberatutti,2016-07-01,18:00,2016-07-01,18:00
4660,347,Independence Day,Hard Rock Cafe,2016-07-04,9:00,2016-07-04,9:00
4646,4476,★Francisco Allendes-Underground session Vol.2 ★,Davidia Club,2016-07-01,21:30,2016-07-01,21:30
4647,1815,OPHIR,Bentigodi - Osteria Chef Domenico,2016-06-29,17:30,2016-06-29,17:30
4640,252,Silent pARTy,Peggy Guggenheim Collection,2016-07-08,19:00,2016-07-08,19:00
4641,209,Fashion at Iuav 2016 - L'Italia è di moda,IUAV Tolentini,2016-06-30,9:00,2016-07-01,18:30
4642,234,ENTI YA AMAR,Centro Culturale Kolbe,2016-07-21,18:30,2016-07-21,18:30
4644,224,"Casinò di Venezia ♦ ""Giovedì sotto le Stelle"" ♦ 30 Giugno w/ M'AMA NON M'AMA",Casinò di Venezia - Ca' Vendramin Calergi,2016-06-30,17:30,2016-06-30,17:30
4634,209,Living Architectures di Ila Bêka e Louise Lemoine,IUAV Tolentini,2016-06-27,17:30,2016-06-27,17:30
4633,209,Venice OPEN STYLE,IUAV Tolentini,2016-06-28,19:00,2016-06-28,19:00
4628,188,"FUEGO ""Hawaian Party""",Aurora Beach,2016-06-29,19:30,2016-06-29,19:30
4629,234,"""Autoritratto siriano"" di  Ossama Mohammed",Centro Culturale Kolbe,2016-07-21,19:30,2016-07-21,19:30
4630,2154,"Milonga sui tetti alla terrazza, Rooftop",Hotel Saturnia & International ,2016-07-24,17:30,2016-07-24,17:30
4631,2048,TERRE FERME,Atelier 3+10,2016-06-30,16:30,2016-06-30,16:30
4632,1247,PCKT,Il Paradiso Perduto,2016-06-27,18:30,2016-06-27,18:30
4626,220,Barbablù,IUAV Terese,2016-07-05,16:00,2016-07-07,16:00
4625,4604,Nightmare nº7,Campazzo San Sebastiano,2016-07-13,20:45,2016-07-13,20:45
4624,4604,Margherita il diavolo lo sa,Campazzo San Sebastiano,2016-07-13,19:30,2016-07-13,19:30
4623,4604,EXIL[S],Campazzo San Sebastiano,2016-07-11,19:45,2016-07-12,19:45
4622,4604,Macbeth in the kitchen,Campazzo San Sebastiano,2016-07-09,19:45,2016-07-10,19:45
4621,4604,I Persiani,Campazzo San Sebastiano,2016-07-08,19:45,2016-07-08,19:45
4620,4604,Racconti del corpo e dell'anima - Musica e danza dall'India,Campazzo San Sebastiano,2016-07-07,20:00,2016-07-07,20:00
4619,4604,"Metamorfosi II, Orfeo Pastiche",Campazzo San Sebastiano,2016-07-07,19:30,2016-07-07,19:30
4618,4604,PERSEPOLIS,Campazzo San Sebastiano,2016-07-06,20:45,2016-07-06,20:45
4617,4604,INSOMNIA,Campazzo San Sebastiano,2016-07-06,19:30,2016-07-06,19:30
4615,4604,ICON,Campazzo San Sebastiano,2016-07-04,19:45,2016-07-05,19:45
4614,4604,There's No Place Like,Campazzo San Sebastiano,2016-07-02,19:45,2016-07-03,19:45
4613,256,"Presentazione del ""Manifesto per il teatro della città""",Scoletta dei Calegheri (Biblioteca di San Tomà),2016-06-28,16:00,2016-06-28,16:00
4612,216,Michele Monetta | Maschera & Maschere. Incontro videoforum sulla maschera nel ‘900.,IUAV Cotonificio Veneziano,2016-07-13,17:30,2016-07-13,17:30
4611,216,"Laura Forti | Storie di fantasmi, il personaggio della donna straniera nel teatro contemporaneo italiano",IUAV Cotonificio Veneziano,2016-07-12,17:30,2016-07-12,17:30
4610,216,Paola Piizzi Sartori e Sarah Sartori | Omaggio all'artista Donato Sartori - Maschera oltre la maschera: scultura viva,IUAV Cotonificio Veneziano,2016-07-11,17:30,2016-07-11,17:30
4609,216,Umberto Fortis e Dario Calimani | Un Ghetto a Venezia nel 1516. Il primo? L'ultimo?,IUAV Cotonificio Veneziano,2016-07-10,17:30,2016-07-10,17:30
4608,216,Monica Centanni e Daniela Sacco | Teatro politico: un'invenzione greca,IUAV Cotonificio Veneziano,2016-07-09,17:30,2016-07-09,17:30
4607,216,Daniele Biacchessi | Dall’inchiesta al teatro civile,IUAV Cotonificio Veneziano,2016-07-08,17:30,2016-07-08,17:30
4606,4604,Inaugurazione Venice Open Stage,Campazzo San Sebastiano,2016-07-01,15:30,2016-07-01,15:30
4605,216,Carmelo Rifici | Appunti di formazione teatrale,IUAV Cotonificio Veneziano,2016-07-03,17:30,2016-07-03,17:30
4602,216,Oberdan Forlenza | Il Teatro come bene comune,IUAV Cotonificio Veneziano,2016-07-06,17:30,2016-07-06,17:30
4601,216,"Fabrizio D’Oria, Cesare Benedetti | Il Senato degli Studenti Iuav",IUAV Cotonificio Veneziano,2016-07-05,17:30,2016-07-05,17:30
4600,216,Giovanni De Luca | Dalla caverna di Platone alle riprese in 4k,IUAV Cotonificio Veneziano,2016-07-04,17:30,2016-07-04,17:30
4599,216,"Leonella Grasso Caprioli, Alberto Ferlenga e Carlotta Scioldo",IUAV Cotonificio Veneziano,2016-07-07,17:30,2016-07-07,17:30
4595,32,"""Romeo e Giulietta"" di franco Zeffirelli",Cinema Multisala Rossini,2016-06-24,16:00,2016-06-24,19:00
4596,361,DIK DIK,Gatto Rosso,2016-06-26,19:00,2016-06-26,19:00
4597,278,Deprive Depraved Images,Fondazione Bevilacqua la Masa - Palazzetto Tito,2016-07-01,16:30,2016-07-01,16:30
4580,315,"Tour del Ghetto, cultura e golosità kosher",Museo Ebraico,2016-06-26,14:45,2016-06-26,14:45
4582,278,Banane,Fondazione Bevilacqua la Masa - Palazzetto Tito,2016-06-28,16:00,2016-06-28,16:00
4586,231,"Dalla natura all'arte: miti, allegorie, piante e animali nei cicli decorativi di Palazzo Grimani",Palazzo Grimani,2016-06-24,15:00,2016-06-24,15:00
4576,111,Primo Festival Internazionale di Arpa,Chiesa di San Francesco della Vigna,2016-06-25,8:00,2016-06-27,9:00
4575,365,Storia Naturale,Scuola Internazionale di Grafica,2016-06-24,15:00,2016-06-24,15:00
4567,15,Leggere in giardino,Fondazione Querini Stampalia,2016-06-23,16:00,2016-06-30,16:00
4568,11,Aspettando Godot,Teatro a l'Avogaria,2016-06-24,19:00,2016-06-26,17:00
4569,"200, 115, 110, 118, 116, 268",VI FESTIVAL ORGANISTICO INTERNAZIONALE GAETANO CALLIDO 2016,"Chiesa di San Trovaso, Chiesa di Santa Maria dei Carmini, Chiesa di Sant'Elena, Chiesa di San Cassiano, Chiesa di San Sebastiano, Chiesa di Santa Maria del Rosario (Gesuati)",2016-07-01,19:00,2016-09-25,13:30
4570,3752,Sanguigno e malinconico - L'Opera Stravagante,Chiesa Anglicana Saint George,2016-07-08,18:00,2016-07-10,18:00
4571,3752,"Estate Fenice - Vivaldi, Vivaldi, Vivaldi!",Chiesa Anglicana Saint George,2016-07-01,18:00,2016-07-03,18:00
4572,3752,Rivals in Venice,Chiesa Anglicana Saint George,2016-06-24,18:00,2016-06-26,18:00
4566,4266,Fort in Fest | Caserma Pepe 3-4 settembre,Caserma Pepe,2016-09-04,8:00,2016-09-03,15:30
4565,4265,Fort in Fest | Batteria Ca' Bianca 8-9 luglio,Batteria Ca' Bianca Angelo Emo,2016-07-08,14:00,2016-07-09,8:00
4563,318,FORT IN FEST | Forte Marghera 2 luglio,Forte Marghera - Parco del Contemporaneo,2016-07-02,14:00,2016-07-02,14:00
4560,4562,Venice and the Hebrew Book,Sale Monumentali | Biblioteca Nazionale Marciana,2016-07-28,13:00,2016-07-28,13:00
4555,1677,Arun Luthra Konnakol Jazz Project,Osteria Da Filo,2016-06-23,17:00,2016-06-23,17:00
4557,151,Solstizio d'estate a Ca'B,Ca' Bembo,2016-06-21,15:30,2016-06-21,15:30
4558,1388,Lontano/vicino,SILOS Art Inside Venezia,2016-06-22,15:30,2016-06-22,15:30
4547,2300,"""Quale Progetto per me?""",PalaPlip,2016-06-21,13:00,2016-06-21,13:00
4548,1418,Festa del Rifugiato,Spazio Aereo,2016-06-22,17:00,2016-06-22,17:00
4550,224,Giovedì sotto le Stelle,Casinò di Venezia - Ca' Vendramin Calergi,2016-06-23,17:30,2016-06-23,17:30
4551,351,"Darsena Residency #2, Open studio 1 Appropriation",Galleria Massimodeluca,2016-06-23,15:00,2016-06-23,15:00
4552,230,Estate al Museo - Sei conversazioni di arte e archeologia,Museo Archeologico Nazionale,2016-06-28,15:00,2016-09-06,15:00
4536,33,Concerto Juraj Valčuha,Teatro La Fenice,2016-07-08,18:00,2016-07-10,18:00
4537,198,"""Venetian Songs"" di Umberto Da Preda",Scuola Grande di San Giovanni Evangelista,2016-06-25,16:30,2016-06-25,16:30
4539,188,FUEGO,Aurora Beach,2016-06-22,19:00,2016-06-22,19:00
4540,32,Omaggio a Jacques Tati,Cinema Multisala Rossini,2016-06-20,15:00,2016-06-23,15:00
4535,181,Le petit déjeuner en blu,Isola di San Servolo,2016-06-19,5:00,2016-06-19,5:00
4532,4533,Festa De San Piero,Campo di San Pietro di Castello,2016-06-26,19:00,2016-07-03,7:00
4530,3604,Stelle e Viaggi,Magazzini del Sale 3,2016-06-18,16:30,2016-06-18,16:30
