id,location_id,title,location,start_date,start_time,end_date,end_time
16093,19,Premio Pietro Torta,"Ateneo Veneto di Scienze, Lettere ed Arti",2021-11-13,10:00,2021-11-13,10:00
16092,19,"Un incontro fra Listz e Dante, Petrarca, Beethoven ","Ateneo Veneto di Scienze, Lettere ed Arti",2021-11-12,17:00,2021-11-12,17:00
16091,19,Due dantisti dell'Ottocento: ,"Ateneo Veneto di Scienze, Lettere ed Arti",2021-11-11,16:30,2021-11-11,16:30
16090,19,Fuoricampo veneziano,"Ateneo Veneto di Scienze, Lettere ed Arti",2021-11-10,16:30,2021-11-10,16:30
16089,19,SINERGIE. Incontri di musica e filosofia ,"Ateneo Veneto di Scienze, Lettere ed Arti",2021-11-09,16:30,2021-11-09,16:30
16088,200,Avvento in Musica 2021,Chiesa di San Trovaso,2021-11-28,15:00,2021-12-19,15:00
16087,19,Se Venezia vive ,"Ateneo Veneto di Scienze, Lettere ed Arti",2021-11-07,10:00,2021-11-07,16:00
16086,355,Camouflage in the landscape ,Palazzo Trevisan degli Ulivi,2021-11-20,13:30,2021-11-20,13:30
16085,33,Incroci di Idee,Teatro La Fenice,2021-11-12,17:30,2021-11-12,17:30
16084,201,Altino in laguna,Biblioteca Nazionale Marciana,2021-11-11,15:30,2021-11-11,15:30
16083,15,Incroci di Civiltà ,Fondazione Querini Stampalia,2021-11-06,9:00,2021-11-06,11:00
16082,15,Corso con Bernard Friot  ,Fondazione Querini Stampalia,2021-11-06,23:00,2021-11-06,23:00
16077,"282, 1511",Grand Tour con ECAL,"Teatrino di Palazzo Grassi, Punta della Dogana",2021-11-18,23:00,2021-11-20,23:00
16076,282,Archipel Luigi Nono ,Teatrino di Palazzo Grassi,2021-11-16,17:00,2021-11-16,17:00
16075,282,Casa delle Parole ,Teatrino di Palazzo Grassi,2021-11-09,17:00,2021-11-09,17:00
16074,282,Dante in lingua francese: 700 anni di traduzione ,Teatrino di Palazzo Grassi,2021-11-08,17:00,2021-11-08,17:00
16073,2,Poetiche del gesto musicale: l’invito alla danza di Giuseppe Albanese,"Conservatorio di Musica ""Benedetto Marcello""",2021-11-08,9:00,2021-11-08,9:00
16072,2,Concerto e premiazione dei vincitori ,"Conservatorio di Musica ""Benedetto Marcello""",2021-11-08,17:00,2021-11-08,17:00
16071,364,Batistococo ,Al Vapore,2021-11-07,19:00,2021-11-07,19:00
16070,364,Matteo Sansonetto ,Al Vapore,2021-11-06,18:15,2021-11-06,20:00
16069,364,Stefano Volpato ,Al Vapore,2021-11-05,18:15,2021-11-05,20:00
16068,364,Max Prandi ,Al Vapore,2021-11-04,18:15,2021-11-04,20:00
16067,143,Grandi navigatori veneziani ,Centro Culturale Candiani,2021-11-05,16:30,2021-11-05,16:30
16066,201,La lettura come conforto,Biblioteca Nazionale Marciana,2021-11-04,15:00,2021-11-04,15:00
16065,"1459, 6620",Venezia Jazz Festival Fall edition ,"Splendid Venice Hotel, Laguna Libre",2021-11-04,18:00,2021-11-05,17:15
16064,231,La nuova sintesi di armonia e contrappunto,Palazzo Grimani,2021-11-07,15:00,2021-11-07,15:00
16063,11,Bricola e Regina ,Teatro a l'Avogaria,2021-11-06,20:00,2021-11-06,20:00
16062,19,La dea stanca. Vita di Lina Bo Bardi ,"Ateneo Veneto di Scienze, Lettere ed Arti",2021-11-04,17:00,2021-11-04,17:00
16061,139,Venezia Jazz Festival,Teatro Toniolo,2021-11-02,20:00,2021-11-02,20:00
16060,19,Corso di Storia dell'Arte 2021,"Ateneo Veneto di Scienze, Lettere ed Arti",2021-11-03,16:30,2021-11-03,16:30
16059,282,Venezia Jazz Festival,Teatrino di Palazzo Grassi,2021-11-01,18:30,2021-11-01,18:30
16058,2703,November Talks 2021,IUAV Palazzo Badoer,2021-11-02,16:00,2021-11-30,16:00
16056,2,Estro poetico-armonico,"Conservatorio di Musica ""Benedetto Marcello""",2021-10-29,15:00,2021-10-29,15:00
16055,139,È sempre una bella stagione,Teatro Toniolo,2021-12-15,15:30,2022-04-22,19:00
16054,"6620, 282, 33, 139",Venezia Jazz Festival Fall Edition,"Laguna Libre, Teatrino di Palazzo Grassi, Teatro La Fenice, Teatro Toniolo",2021-10-29,16:15,2021-11-02,20:00
16053,"283, 282, 2, 1213",Festival Luigi Nono ,"Fondazione Archivio Luigi Nono Onlus, Teatrino di Palazzo Grassi, Conservatorio di Musica ""Benedetto Marcello"", Fondazione Prada",2021-11-03,16:00,2021-11-27,18:00
16052,"29, 34",Aperture serali straordinarie,"Palazzo Ducale, Museo Correr",2021-10-29,22:00,2021-12-06,23:00
16051,364,Marco Pitteri presenta ,Al Vapore,2021-10-27,17:30,2021-10-27,17:30
16050,364,Duo Piano Voce,Al Vapore,2021-10-28,17:30,2021-10-28,17:30
16049,364,"""Scene di Vita Quotidiana""",Al Vapore,2021-10-29,17:00,2021-10-29,17:00
16048,364,Sound Jumble ,Al Vapore,2021-10-29,19:00,2021-10-29,19:00
16047,364,Buon Compleanno Al Vapore,Al Vapore,2021-10-29,22:00,2021-10-29,22:00
16046,364,Radio Rebelde Live Show ,Al Vapore,2021-10-31,20:00,2021-10-31,20:00
16045,19,Eugenio Miozzi. Venezia tra innovazione e tradizione 1931 - 1969,"Ateneo Veneto di Scienze, Lettere ed Arti",2021-10-28,16:00,2021-10-28,16:00
16044,201,Le vite dei Padri ,Biblioteca Nazionale Marciana,2021-10-28,15:00,2021-10-28,15:00
16043,"3185, 16042","Perle, fra fiori e nuovi caleidoscopi","Museo di Storia Naturale di Venezia, Atelier La Perla Veneziana",2021-10-30,22:00,2021-11-06,23:00
16041,19,Platone nella Repubblica (digitale) ,"Ateneo Veneto di Scienze, Lettere ed Arti",2021-10-29,15:30,2021-10-29,15:30
16040,35,Strappi,Palazzo Grassi,2021-10-26,22:00,2021-11-23,23:00
16039,19,Sette Giorni a Venezia,"Ateneo Veneto di Scienze, Lettere ed Arti",2021-10-26,15:30,2021-10-26,15:30
16038,19,Il Tesoro sopravvissuto del Museo del Duomo di Caorle. Argenti medievali e barocchi,"Ateneo Veneto di Scienze, Lettere ed Arti",2021-10-27,15:30,2021-10-27,15:30
16037,231,Josquin de Prez. La musica nell’Italia di Leonardo e del Magnifico ,Palazzo Grimani,2021-10-29,14:00,2021-10-29,14:00
16036,15984,Parole di carta  ,Piazza Donatori di sangue,2021-10-27,18:45,2021-10-27,18:45
16035,209,ESPACIAR,IUAV Tolentini,2021-10-27,22:00,2021-10-27,22:00
16034,138,Altripiani,Fontego dei Tedeschi,2021-10-27,16:30,2021-10-27,16:30
16032,11,Stand Up Comedy ,Teatro a l'Avogaria,2021-11-13,20:00,2022-05-14,19:00
16030,139,UP & Down ,Teatro Toniolo,2021-11-04,23:00,2021-11-07,17:00
16029,2,Le carnaval des anìmaux,"Conservatorio di Musica ""Benedetto Marcello""",2021-10-30,13:30,2021-10-30,13:30
16028,2,Intergale delle opere per due pianoforti ,"Conservatorio di Musica ""Benedetto Marcello""",2021-10-29,16:00,2021-10-29,16:00
16027,2,Zip Guitar Festival Progetto Carulli 2020,"Conservatorio di Musica ""Benedetto Marcello""",2021-10-22,13:00,2021-10-22,13:00
16025,27,Claudio Baglioni in concerto,Teatro Malibran,2022-02-20,20:00,2022-02-20,20:00
16024,231,Cavallettere ,Palazzo Grimani,2021-10-27,15:30,2021-10-27,15:30
16023,364,The Right Keys ,Al Vapore,2021-10-21,18:30,2021-10-21,18:30
16022,364,Flavio Paludetti & Perpetual Soul Machine ,Al Vapore,2021-10-23,17:15,2021-10-23,19:00
16021,364,Cambiamento Climatico...a Piedi ,Al Vapore,2021-10-22,17:30,2021-10-22,17:30
16020,35, Atelier des Enfants ,Palazzo Grassi,2021-10-22,22:00,2021-12-17,23:00
16019,12001,Asolo Musica,Auditorium 'Lo Squero',2021-11-06,15:30,2021-12-18,15:30
16017,19,Viver tra coloro / che questo tempo chiameranno antico ,"Ateneo Veneto di Scienze, Lettere ed Arti",2021-10-22,15:00,2021-10-22,15:00
16016,19,Diario di un Naufrago Felice ,"Ateneo Veneto di Scienze, Lettere ed Arti",2021-10-21,16:00,2021-10-21,16:00
16015,19,Corso di Storia dell’Oreficeria e Arti Decorative ,"Ateneo Veneto di Scienze, Lettere ed Arti",2021-10-20,15:30,2021-10-20,15:30
16014,1658,Quartetti sfavillanti,Palazzetto Bru Zane,2021-11-12,18:30,2021-11-12,18:30
16013,1658,Trii imperiali,Palazzetto Bru Zane,2021-11-04,18:30,2021-11-04,18:30
16011,278,I Video di Guido Sartorelli,Fondazione Bevilacqua la Masa - Palazzetto Tito,2021-10-21,15:30,2021-10-21,15:30
16010,15800, Soul Spritz Duo Live,Basegone,2021-10-19,17:30,2021-10-19,17:30
16009,1658,Chitarre eroiche,Palazzetto Bru Zane,2021-10-19,17:30,2021-10-19,17:30
16008,27,Ėliso Virsaladze in recital ,Teatro Malibran,2021-11-19,19:00,2021-11-19,19:00
16007,33,Petruška ,Teatro La Fenice,2021-11-19,17:00,2021-11-19,17:00
16006,33,Musikamera,Teatro La Fenice,2021-11-15,19:00,2021-11-16,19:00
16005,27,Cenerentola,Teatro Malibran,2021-11-13,19:00,2021-11-13,19:00
16004,33,Musica con le Ali,Teatro La Fenice,2021-11-11,19:00,2021-11-11,19:00
16003,33,Fidelio,Teatro La Fenice,2021-11-20,18:00,2021-11-30,18:00
16002,33,Ex Novo Ensemble,Teatro La Fenice,2021-11-10,19:00,2021-11-10,19:00
16001,33,Ensemble Aurora ,Teatro La Fenice,2021-11-09,19:00,2021-11-09,19:00
16000,33,Giuseppe Albanese in Recital,Teatro La Fenice,2021-11-08,19:00,2021-11-08,19:00
15999,27,Galà con i giovani talenti de l’Opera de Paris ,Teatro Malibran,2021-11-06,19:00,2021-11-07,16:30
15998,33,Ferdinando Romano,Teatro La Fenice,2021-11-06,18:30,2021-11-06,18:30
15997,33,Emanuele Arciuli in Recital,Teatro La Fenice,2021-11-02,19:00,2021-11-03,19:00
15996,201,Grecità lagunare e dintorni ,Biblioteca Nazionale Marciana,2021-10-21,14:30,2021-10-21,14:30
15993,282,Gestus I atto: Rifare il corpo,Teatrino di Palazzo Grassi,2021-10-15,16:00,2021-10-17,8:00
15992,252,Arte alle Donne! ,Peggy Guggenheim Collection,2021-10-18,17:00,2021-11-22,18:00
15991,15,La Cura,Fondazione Querini Stampalia,2021-10-16,8:00,2021-10-16,8:00
15990,15,La Cura,Fondazione Querini Stampalia,2021-10-16,8:00,2021-10-16,8:00
15989,"157, 12001",Incroci di civiltà ,"Ca' Foscari, Auditorium 'Lo Squero'",2021-11-03,17:00,2021-11-07,10:30
15988,364,Enrico Crivellaro Band,Al Vapore,2021-10-16,17:15,2021-10-16,19:00
15987,364,Rosita Kèss,Al Vapore,2021-10-15,17:15,2021-10-15,19:00
15986,364,Prospettiva Nevsky,Al Vapore,2021-10-14,17:15,2021-10-14,19:00
15985,15984,Parole di carta ,Piazza Donatori di sangue,2021-10-20,18:45,2021-10-20,18:45
15983,14360,Tra Arte e Design: imprese e territorio ,Arsenale Nord - Tesa 94,2021-10-14,15:00,2021-10-14,15:00
15982,19,I Santillana,"Ateneo Veneto di Scienze, Lettere ed Arti",2021-10-17,9:00,2021-10-17,9:00
15981,19,Viver tra coloro / che questo tempo chiameranno antico ,"Ateneo Veneto di Scienze, Lettere ed Arti",2021-10-15,15:00,2021-10-15,15:00
15980,19,Carlo Moretti vetro e design ,"Ateneo Veneto di Scienze, Lettere ed Arti",2021-10-14,16:00,2021-10-14,16:00
15981,19,Viver tra coloro / che questo tempo chiameranno antico ,"Ateneo Veneto di Scienze, Lettere ed Arti",2021-10-15,15:00,2021-10-15,15:00
15980,19,Carlo Moretti vetro e design ,"Ateneo Veneto di Scienze, Lettere ed Arti",2021-10-14,16:00,2021-10-14,16:00
15979,12001,Abel Selaocoe & Dudu Kouate duo ,Auditorium 'Lo Squero',2021-10-15,17:30,2021-10-15,17:30
15978,19,Restauro dei mosaici con pavoni della Basilica di San Marco,"Ateneo Veneto di Scienze, Lettere ed Arti",2021-10-13,15:30,2021-10-13,15:30
15977,1658,Non solo un “cuculo corso”: Napoleone a Venezia,Palazzetto Bru Zane,2021-11-09,17:00,2021-11-09,17:00
15976,1476,"Arte, fantasia e colore ",Fondazione Giorgio Cini,2021-10-20,9:00,2021-10-20,9:00
15975,1658,Attorno al Napoleone di Abel Gance: un itinerario tra cinema e musica,Palazzetto Bru Zane,2021-10-26,16:00,2021-10-26,16:00
15974,1658,"Napoleone Bonaparte, l’imperatore che amava la musica",Palazzetto Bru Zane,2021-10-12,16:00,2021-10-12,16:00
15973,278,I video di Guido Sartorelli,Fondazione Bevilacqua la Masa - Palazzetto Tito,2021-10-14,13:30,2021-10-14,15:30
15972,192,Veleziana,Bacino di San Marco,2021-10-16,22:00,2021-10-16,22:00
15970,1658,La marchesa del pianoforte,Palazzetto Bru Zane,2021-10-08,17:30,2021-10-08,17:30
15969,139,I soliti ignoti,Teatro Toniolo,2022-01-15,20:00,2022-01-16,15:30
15968,139,Gio Evan - Abissale,Teatro Toniolo,2021-12-13,20:00,2021-12-13,20:00
15967,139," Io Sarah, io Tosca ",Teatro Toniolo,2021-12-10,18:30,2021-12-19,15:30
15966,139,Il nodo,Teatro Toniolo,2021-11-19,20:00,2021-11-28,15:30
15965,139,Cenere Cenerentola,Teatro Toniolo,2021-11-09,18:30,2021-11-10,18:30
15964,139,Il marito invisibile,Teatro Toniolo,2021-10-22,19:00,2021-10-31,15:30
15961,364,"Carlito, Willy and SirJoe ",Al Vapore,2021-10-08,17:15,2021-10-08,19:00
15960,364,Max Bullo e Tommaso Genovesi Duo ,Al Vapore,2021-10-07,17:15,2021-10-07,19:00
15959,364,"""Il Cormorano Nero""",Al Vapore,2021-10-06,19:00,2021-10-06,19:00
15958,1476,Libri a San Giorgio ,Fondazione Giorgio Cini,2021-10-15,15:00,2021-10-15,15:00
15957,1459,Venezia Jazz Festival Fall edition,Splendid Venice Hotel,2021-10-07,17:00,2021-11-04,18:00
15956,"3198, 3964, 3436, 11080, 319",Design X tutti ,"Galleria Giorgio Franchetti alla Ca' d'Oro, Design Hotel Ca' Pisani, Palazzo Contarini Polignac,  Ca' Nigra Lagoon Resort, Palazzo Bembo",2021-10-08,22:00,2021-10-16,22:00
15955,282,Lezioni d'artista ,Teatrino di Palazzo Grassi,2021-10-06,22:00,2021-10-09,22:00
15954,15,Ca' Foscari Short Film Festival ,Fondazione Querini Stampalia,2021-10-06,15:00,2021-10-07,17:00
15953,36,L'attesa,Teatro Stabile del Veneto Carlo Goldoni,2022-05-05,18:30,2022-05-08,14:00
15952,36,Eichmann dove inizia la notte,Teatro Stabile del Veneto Carlo Goldoni,2022-03-17,19:30,2022-03-20,15:00
15951,36,La peste di Camus,Teatro Stabile del Veneto Carlo Goldoni,2022-03-10,19:30,2022-03-13,15:00
15950,36,Il delitto di via dell'Orsina,Teatro Stabile del Veneto Carlo Goldoni,2022-04-12,18:30,2022-04-14,18:30
15949,36,Ramona - Violetta - Alfredo,Teatro Stabile del Veneto Carlo Goldoni,2022-02-23,19:30,2022-02-27,15:00
15948,36,Pupo di zucchero,Teatro Stabile del Veneto Carlo Goldoni,2021-12-16,19:30,2021-12-17,18:00
15947,36,Spettri,Teatro Stabile del Veneto Carlo Goldoni,2022-02-03,19:30,2022-02-06,15:00
15946,36,Tempest Project,Teatro Stabile del Veneto Carlo Goldoni,2022-02-10,19:30,2022-02-13,15:00
15945,36,I due gemelli veneziani ,Teatro Stabile del Veneto Carlo Goldoni,2021-12-09,19:30,2021-12-12,15:00
15944,36,Maria Callas ,Teatro Stabile del Veneto Carlo Goldoni,2021-11-26,19:30,2021-11-27,18:00
15943,36,Marco Masini ,Teatro Stabile del Veneto Carlo Goldoni,2021-11-23,20:00,2021-11-23,20:00
15942,141,Giornata Europea della Cultura Ebraica ,Campo del Ghetto Novo,2021-10-09,22:00,2021-10-09,22:00
15941,201,Alessandro al bivio,Biblioteca Nazionale Marciana,2021-10-12,14:00,2021-10-12,14:00
15940,"6620, 12001, 139, 33, 282, 2953",Venezia Jazz Festival,"Laguna Libre, Auditorium 'Lo Squero', Teatro Toniolo, Teatro La Fenice, Teatrino di Palazzo Grassi, Spazio M9",2021-10-07,17:00,2021-11-14,17:00
15939,13683,Venicemarathon,Villa Pisani,2021-10-23,22:00,2021-10-23,22:00
15938,231,Ca' Foscari Short Film Festival ,Palazzo Grimani,2021-10-08,13:00,2021-10-08,13:00
15937,33,Concerto diretto da Jonathan Brett,Teatro La Fenice,2021-10-31,18:00,2021-10-31,18:00
15936,27,"Io Maria, lei Callas",Teatro Malibran,2021-10-30,18:00,2021-10-31,16:30
15935,33,Danilo Squitieri e Enzo Oliva,Teatro La Fenice,2021-10-29,18:00,2021-10-29,18:00
15934,33,Concerto diretto da Claudio Marino Moretti,Teatro La Fenice,2021-10-28,18:00,2021-10-28,18:00
15933,33,Premio una vita nella musica,Teatro La Fenice,2021-10-28,9:30,2021-10-28,9:30
15932,33,Quartetto Adorno,Teatro La Fenice,2021-10-26,18:00,2021-10-27,18:00
15931,33,Ludus Minor ,Teatro La Fenice,2021-10-24,18:00,2021-10-24,18:00
15930,33,Concerto diretto da Mario Venzago ,Teatro La Fenice,2021-10-23,18:00,2021-10-24,15:00
15929,27,Alice canta Battiato,Teatro Malibran,2021-10-22,19:00,2021-10-23,19:00
15928,33,Gaia Trionfera e Alessandro Taverna in concerto,Teatro La Fenice,2021-10-21,18:00,2021-10-21,18:00
15927,27,40 anni di Quartetto Venezia,Teatro Malibran,2021-10-21,18:00,2021-10-21,18:00
15926,33,Quantum one ,Teatro La Fenice,2021-10-18,18:00,2021-10-18,18:00
15925,33,Concerto diretto da Hartmut Haenchen ,Teatro La Fenice,2021-10-16,18:00,2021-10-17,15:00
15924,27,Engelberta,Teatro Malibran,2021-10-14,9:00,2021-10-16,13:30
15923,33,Domenico Nordio e Orazio Sciortino,Teatro La Fenice,2021-10-12,18:00,2021-10-13,18:00
15922,33,Giovanni Sollima e Carlotta Maestrini in concerto,Teatro La Fenice,2021-10-11,18:00,2021-10-11,18:00
15921,33,Rigoletto,Teatro La Fenice,2021-10-05,17:00,2021-10-10,13:30
15920,19,Letteratura veneta tra '900 e 2000,"Ateneo Veneto di Scienze, Lettere ed Arti",2021-10-08,15:30,2021-10-08,15:30
15919,19,La nuova terra  ,"Ateneo Veneto di Scienze, Lettere ed Arti",2021-10-07,16:00,2021-10-07,16:00
15918,19,Tesori nascosti e ritrovati,"Ateneo Veneto di Scienze, Lettere ed Arti",2021-10-06,15:30,2021-10-06,15:30
15917,19,Lepanto. Prima e dopo la battaglia,"Ateneo Veneto di Scienze, Lettere ed Arti",2021-10-04,16:00,2021-10-04,16:00
15916,36,I was sitting on my patio,Teatro Stabile del Veneto Carlo Goldoni,2021-11-11,19:30,2021-11-14,15:00
15915,36,Turandot,Teatro Stabile del Veneto Carlo Goldoni,2021-10-14,18:30,2021-10-17,14:00
15914,19,Art Night 2021,"Ateneo Veneto di Scienze, Lettere ed Arti",2021-10-02,16:00,2021-10-02,16:00
15913,11,Corsi di recitazione ,Teatro a l'Avogaria,2021-09-29,22:00,2021-10-30,22:00
15912,231,La musica al tempo di Dante ,Palazzo Grimani,2021-10-03,14:00,2021-10-03,14:00
15911,201,Archeologia e tecnologia digitale per le indagini sulla laguna di Venezia ,Biblioteca Nazionale Marciana,2021-10-07,14:30,2021-10-07,14:30
15909,192,Venice Hospitality Challenge ,Bacino di San Marco,2021-10-16,11:30,2021-10-16,11:30
15908,15,Art Night 2021  ,Fondazione Querini Stampalia,2021-10-02,16:00,2021-10-02,16:00
15907,"2, 33, 1218","Ombre Romite, taciti orrori ","Conservatorio di Musica ""Benedetto Marcello"", Teatro La Fenice, Fondazione Ugo e Olga Levi Onlus",2021-10-15,12:15,2021-10-17,7:00
15906,"3005, 319",La-tèn-te ,"Palazzo Mora, Palazzo Bembo",2021-10-02,15:00,2021-10-02,19:30
15905,5661,Ti racconto i 10 anni del Negozio Olivetti ,FAI - Negozio Olivetti,2021-09-27,16:30,2021-11-20,17:30
15903,15,Il Suono di Dante ,Fondazione Querini Stampalia,2021-09-28,19:00,2021-09-28,19:00
15901,2117,M'illumino di spezie,Pescheria di Rialto,2021-09-25,22:00,2021-09-25,22:00
15900,157,Venetonight - Ca' Foscari,Ca' Foscari,2021-09-24,22:00,2021-09-24,22:00
15899,364,To The Bridge_Jazz Trio ,Al Vapore,2021-09-25,17:15,2021-09-25,19:00
15898,364,Fab-Ensemble ,Al Vapore,2021-09-24,17:15,2021-09-24,19:00
15897,231,Cultura nella differenza: conoscere per riconoscersi a Palazzo Grimani,Palazzo Grimani,2021-09-24,22:00,2021-09-25,22:00
15895,19,Il senso dell'abitare: Happy stations,"Ateneo Veneto di Scienze, Lettere ed Arti",2021-09-22,15:00,2021-09-22,15:00
15894,19,"Crisi ecologica, crisi sanitaria ","Ateneo Veneto di Scienze, Lettere ed Arti",2021-09-21,15:00,2021-09-21,15:00
15893,15,Maratona di lettura 2021,Fondazione Querini Stampalia,2021-09-24,16:00,2021-09-24,16:00
15889,198, Vittoria! ,Scuola Grande di San Giovanni Evangelista,2021-09-25,17:30,2021-09-25,17:30
15888,198, Vittoria! ,Scuola Grande di San Giovanni Evangelista,2021-09-25,17:30,2021-09-25,17:30
15884,282,Teatrino di Palazzo Grassi,Teatrino di Palazzo Grassi,2021-09-15,22:00,2021-12-15,23:00
15883,6620,Venezia Jazz Festival,Laguna Libre,2021-10-01,17:00,2021-10-08,17:00
15882,"288, 3238",XVII Festival dei Giardini Veneziani,"Palazzo Cavalli Franchetti, Ca' Zanardi",2021-10-01,13:30,2021-10-03,9:30
15879,15,A Tiziano Scarpa il Premio Montale Fuori di Casa per la Narrativa  ,Fondazione Querini Stampalia,2021-09-17,15:30,2021-09-17,15:30
15878,157,Dream of Winter Gondola di Philippe Starck,Ca' Foscari,2021-09-12,22:00,2021-09-29,22:00
15877,231,Benedetto Marcello ,Palazzo Grimani,2021-09-19,14:00,2021-09-19,14:00
15874,3894,Sunglassdays,Le Stanze del Vetro,2021-09-12,8:30,2021-09-26,8:30
15873,263,Sulla via delle perle,Biblioteca di Murano,2021-09-10,22:00,2021-09-11,22:00
15871,12001,Auditorium Lo Squero,Auditorium 'Lo Squero',2021-09-18,13:00,2021-12-18,14:00
15870,231,TRIO TORANJ ,Palazzo Grimani,2021-09-11,16:00,2021-09-11,16:00
15869,231,Carte de tendre ,Palazzo Grimani,2021-09-10,14:30,2021-09-10,14:30
15867,6620,David Boato in trio al Laguna Libre,Laguna Libre,2021-09-10,17:30,2021-09-10,17:30
15866,"2953, 139",Festival della Politica 2021 ,"Spazio M9, Teatro Toniolo",2021-09-08,22:00,2021-09-11,22:00
15863,364,Carly & Pera duo senza riserve ,Al Vapore,2021-09-12,17:15,2021-09-12,19:00
15862,364,Francesca Della Puppa Quartet ,Al Vapore,2021-09-11,17:15,2021-09-11,19:00
15861,364,Still Stones ,Al Vapore,2021-09-10,17:15,2021-09-10,19:00
15860,364,Salt&Pepper ,Al Vapore,2021-09-09,17:15,2021-09-09,19:00
15857,7195,La Regata Storica ,Canal Grande,2021-09-02,16:00,2021-09-05,14:00
15856,7447,The Venice Glass Week ,Venezia Città Metropolitana,2021-09-03,22:00,2021-09-11,22:00
15855,2,Concerto “Per Mario Messinis”,"Conservatorio di Musica ""Benedetto Marcello""",2021-09-08,16:30,2021-09-08,16:30
15854,2,PER MARIO MESSINIS,"Conservatorio di Musica ""Benedetto Marcello""",2021-09-08,8:00,2021-09-08,16:30
15851,364,RaRo acoustic duo ,Al Vapore,2021-09-03,17:15,2021-09-03,19:00
15850,364,Lilac & Friends ,Al Vapore,2021-09-04,17:15,2021-09-04,19:00
15849,364,The Alchemical Experience ,Al Vapore,2021-09-05,19:00,2021-09-05,19:00
15848,364,"Andar Sevénte, tornar Dosàna ",Al Vapore,2021-09-02,17:00,2021-09-02,17:00
15847,"2953, 139, 27",Festival delle Idee,"Spazio M9, Teatro Toniolo, Teatro Malibran",2021-09-29,22:00,2021-10-21,22:00
15846,318,Venere in teatro,Forte Marghera - Parco del Contemporaneo,2021-09-07,16:30,2021-09-12,18:45
15845,231,Etnoborder ,Palazzo Grimani,2021-09-11,16:00,2021-09-25,18:00
15844,231,The Leading Guy ,Palazzo Grimani,2021-09-02,17:30,2021-09-02,17:30
15843,19,Venezia nei Campielli  ,"Ateneo Veneto di Scienze, Lettere ed Arti",2021-09-03,16:00,2021-09-03,16:00
15840,15839,Comitato Rialto Novo,Giardini Reali,2021-09-08,14:30,2021-09-14,13:30
15838,2465,I Sabato di Rialto ,Campo San Polo,2021-09-04,9:00,2021-09-25,9:00
15837,14,Intorno al Festival dei Matti ,Campo Santa Maria Formosa,2021-09-01,16:00,2021-09-08,16:00
15836,231,Accademia degli Unisoni ,Palazzo Grimani,2021-08-25,15:00,2021-08-28,14:00
15834,9947,Cinema Galleggiante - Acque Sconosciute ,Giudecca,2021-08-20,16:00,2021-09-04,16:00
15833,282,The Whole Mahalla ,Teatrino di Palazzo Grassi,2021-08-25,16:00,2021-08-25,16:00
15832,1511,In&Out,Punta della Dogana,2021-08-26,15:00,2021-09-30,14:30
15831,364,Funk Trail,Al Vapore,2021-08-20,17:15,2021-08-20,19:00
15830,364,L'Universo,Al Vapore,2021-08-22,17:15,2021-08-22,19:00
15829,364,Comunque Lucio,Al Vapore,2021-08-21,17:15,2021-08-21,19:00
15827,330,78. Mostra Internazionale d’Arte Cinematografica  ,Palazzo del Cinema,2021-08-31,22:00,2021-09-10,22:00
15826,15825,Grand Central Literary Festival  ,Grand Central,2021-09-01,16:45,2021-10-06,16:45
15824,144,Venice Film Week 2021,Casa del Cinema - Videoteca Pasinetti,2021-08-23,18:00,2021-08-27,18:00
15823,200,XI Festival Organistico Internazionale Gaetano Callido ,Chiesa di San Trovaso,2021-09-03,19:00,2021-09-24,19:00
15822,15328,Murano in Focus,Punta Conterie,2021-08-28,19:00,2021-08-28,19:00
15821,231,L’Autunno del Madrigale ,Palazzo Grimani,2021-08-10,15:00,2021-08-10,15:00
15820,6620,Speciale standard trio al Laguna Libre ,Laguna Libre,2021-08-07,18:30,2021-08-07,18:30
15819,364,Elena Camerin Young e Paolo Vianello Duo,Al Vapore,2021-08-07,17:15,2021-08-07,19:00
15818,364,Lilac & Friends ,Al Vapore,2021-08-06,17:15,2021-08-06,19:00
15817,364,L'Universo + Villaggio68 ,Al Vapore,2021-08-05,17:15,2021-08-05,19:00
15816,1511,Soirée,Punta della Dogana,2021-08-05,16:00,2021-09-16,16:00
15815,5661,La cerimonia del Te' ,FAI - Negozio Olivetti,2021-08-13,22:00,2021-08-27,22:00
15812,"12385, 2, 33, 12001, 27",65° Festival Internazionale di Musica Contemporanea ,"Arsenale di Venezia, Conservatorio di Musica ""Benedetto Marcello"", Teatro La Fenice, Auditorium 'Lo Squero', Teatro Malibran",2021-09-16,22:00,2021-09-25,22:00
15809,"6620, 7073",Venezia Jazz Festival,"Laguna Libre, Caffé ai Crociferi",2021-07-30,18:30,2021-07-31,19:30
15808,364,The Black Boys ,Al Vapore,2021-08-01,17:15,2021-08-01,19:00
15807,364,Magical Mystery,Al Vapore,2021-07-30,17:15,2021-07-30,19:00
15806,364,Bonsai Duo,Al Vapore,2021-07-29,17:15,2021-07-29,19:00
15805,364, SmartJazz Trio ,Al Vapore,2021-07-28,17:15,2021-07-28,19:00
15804,36,Arlecchino furioso,Teatro Stabile del Veneto Carlo Goldoni,2021-07-28,17:00,2021-07-29,17:00
15803,231,Venus & Adonis ,Palazzo Grimani,2021-08-01,15:00,2021-08-01,15:00
15802,25,Biennale Danza 2021,Teatro alle Tese,2021-07-22,22:00,2021-07-31,22:00
15801,15800, Soul Spritz Duo live,Basegone,2021-07-27,17:30,2021-07-27,17:30
15798,15797,Gli occhi di Venezia,Campo Sant'Agnese,2021-08-07,15:00,2021-08-07,15:00
15794,15,Paesaggi di carta e di suoni ,Fondazione Querini Stampalia,2021-07-29,17:00,2021-07-29,17:00
15793,1182,Passeggiando con Otello&Jago ,Campo della Salute,2021-08-01,8:30,2021-08-15,8:30
15792,364,Ginga Duo,Al Vapore,2021-07-23,17:00,2021-07-23,17:00
15791,364,Sir Oliver Skardy  ,Al Vapore,2021-07-21,18:00,2021-07-21,18:00
15790,364,Faraò Barbon Landham Trio ,Al Vapore,2021-07-24,17:00,2021-07-24,17:00
15789,4704,Women for Freedom in Jazz ,Hotel Carlton On The Grand Canal,2021-07-22,18:30,2021-09-23,18:30
15788,138,Al Fondaco dei Tedeschi Daniela Gambaro ,Fontego dei Tedeschi,2021-07-22,17:00,2021-07-22,17:00
15787,6620,"cUORE, concerto con giocattolo di Daniele Vianello",Laguna Libre,2021-07-23,18:30,2021-07-23,18:30
15786,36,Tutta la vita,Teatro Stabile del Veneto Carlo Goldoni,2021-07-22,17:00,2021-07-23,17:00
15785,2162,Cinema barch-in ,Arsenale - Darsena Grande,2021-07-23,22:00,2021-07-30,22:00
15782,2,"Trio Bottesini, S. Mao, Trio Dvorak","Conservatorio di Musica ""Benedetto Marcello""",2021-08-28,19:00,2021-08-28,19:00
15781,2,"Les Sauvages, Duo En Plein Air, Woodstrings Duo","Conservatorio di Musica ""Benedetto Marcello""",2021-08-21,19:00,2021-08-21,19:00
15780,2,Orchestra Giovanile del Conservatorio,"Conservatorio di Musica ""Benedetto Marcello""",2021-08-14,19:00,2021-08-14,19:00
15779,2,"Duo Leil, Quartetto Cromie","Conservatorio di Musica ""Benedetto Marcello""",2021-08-07,19:00,2021-08-07,19:00
15778,2,"Harmony Duo, Four Quartet, Bass Brasses","Conservatorio di Musica ""Benedetto Marcello""",2021-07-31,19:00,2021-07-31,19:00
15777,2,"Trio Tactus, Trio Lebensfreude, Doble Voz Duo","Conservatorio di Musica ""Benedetto Marcello""",2021-07-24,19:00,2021-07-24,19:00
