id,location_id,title,location,start_date,start_time,end_date,end_time
13855,"9400, 284",Mesthriller Xmas,"Libreria Ubik, Teatro Arnaldo Momo",2018-12-11,17:00,2018-12-14,17:00
13853,251,Giornate Animate,Accademia di Belle Arti di Venezia,2018-12-11,14:00,2018-12-19,13:30
13851,112,Gran concerto dell'Immacolata nella basilica dei Santi Giovanni e Paolo ,Basilica dei Santi Giovanni e Paolo,2018-12-08,16:00,2018-12-08,16:00
13850,13759,CARLO ZEN. L’EROE DI CHIOGGIA,Libreria La Bottega di Manuzio,2018-12-10,17:00,2018-12-10,17:00
13849,147, LO SPETTACOLARE TRIBUTO  DEI QUEENMANIA A FREDDIE MERCURY E I QUEEN,Cinema Teatro Corso,2018-12-14,20:15,2018-12-14,20:15
13848,13786,M9 - Ritrovamenti archeologici e restauro dei manufatti storici del complesso di S. Maria delle Grazie.,M9 - Museo del Novecento,2018-12-10,14:00,2018-12-10,14:00
13847,138,La Big Band del Conservatorio di musica Benedetto Marcello di Venezia T Fondaco dei Tedeschi ,Fontego dei Tedeschi,2018-12-14,14:00,2018-12-20,18:30
13846,9565,Alessandro Pozzetto & The rising Vibrations XMAS 2018 ,Nave de Vero,2018-12-08,20:00,2018-12-08,20:00
13845,147,"I LEGNANESI ""70 Anni di Risate""",Cinema Teatro Corso,2018-12-16,16:00,2018-12-16,16:00
13843,364,I Macachi ,Al Vapore,2018-12-09,20:00,2018-12-09,20:00
13842,364,Venezia calls Chicago ,Al Vapore,2018-12-06,20:00,2018-12-06,20:00
13841,364,Eric Alexander & “Swiss – Italian Jazz Allies“,Al Vapore,2018-12-08,20:00,2018-12-08,20:00
13840,36,Alberto Angela - Cleopatra,Teatro Stabile del Veneto Carlo Goldoni,2018-12-17,17:00,2018-12-17,17:00
13839,36,Giro di vite,Teatro Stabile del Veneto Carlo Goldoni,2018-12-13,19:30,2018-12-16,15:00
13837,143,Mirkoeilcane live al centro culturale Candiani ,Centro Culturale Candiani,2018-12-07,20:00,2018-12-07,20:00
13836,204,"Venyl, mostra e fiera del disco in vinile",Centro Sociale Rivolta,2018-12-09,9:00,2018-12-09,9:00
13835,"29, 230, 34, 134, 102, 103, 104, 105, 106",Musei in Festa,"Palazzo Ducale, Museo Archeologico Nazionale, Museo Correr, Ca' Pesaro, Palazzo Mocenigo, Ca' Rezzonico, Casa di Carlo Goldoni, Museo del Vetro, Museo del Merletto",2018-12-07,23:00,2018-12-07,23:00
13834,19,I lunedì dell’Architettura - Ateneo Veneto ,"Ateneo Veneto di Scienze, Lettere ed Arti",2018-12-10,16:30,2019-02-25,16:30
13832,172, Blockchain&ICO,Ca' Foscari San Giobbe,2018-12-06,14:00,2018-12-06,14:00
13831,139, LE LUCI DELLA CENTRALE ELETTRICA,Teatro Toniolo,2018-12-18,20:00,2018-04-03,19:00
13830,147,BALLETTO RUSSO CON “LA BELLA ADDORMENTATA”,Cinema Teatro Corso,2018-12-09,17:00,2018-12-09,17:00
13829,139,OBLIVION in “La Bibbia riveduta e scorretta”,Teatro Toniolo,2018-12-06,20:00,2018-12-06,20:00
13828,11,SUPERFICIE IN R4 ,Teatro a l'Avogaria,2018-12-04,20:00,2018-12-04,20:00
13826,2,Un Pianoforte per due,"Conservatorio di Musica ""Benedetto Marcello""",2018-12-07,16:00,2018-12-07,16:00
13825,282,Dicembre a Palazzo Grassi e Punta della Dogana,Teatrino di Palazzo Grassi,2018-12-02,17:00,2018-12-15,23:00
13822,11," ""Prestaci i tuoi occhiali Peggy""",Teatro a l'Avogaria,2018-12-01,20:00,2018-12-01,20:00
13821,11080, Xmas Artisan Market, Ca' Nigra Lagoon Resort,2018-12-02,8:30,2018-12-02,8:30
13820,1476,Shakespeare all'Opera,Fondazione Giorgio Cini,2018-11-29,16:00,2018-11-29,16:00
13819,19,Dicembre all'Ateneo Veneto,"Ateneo Veneto di Scienze, Lettere ed Arti",2018-12-02,10:00,2018-12-21,16:30
13818,12559,Adesso Pasta!,Fattoria Bio sociale Il Rosmarino,2018-12-01,9:00,2018-12-02,11:00
13817,364,Tolo Marton Band feat. Rita Girelli,Al Vapore,2018-12-01,20:00,2018-12-01,20:00
13816,364,FreshenUp presenta: Filippo Vignato Trio + Marta Raviglia,Al Vapore,2018-11-30,20:00,2019-02-22,20:00
13815,364,CSN&Y HOMMAGE,Al Vapore,2018-11-29,20:00,2018-11-29,20:00
13814,2156,Pista di pattinaggio in Piazza Ferretto a Mestre,Piazza Ferretto,2018-12-01,10:00,2019-01-06,10:00
13813,"8122, 9561",Natale con noi' a Catene e Marghera,"Parco Nuovo Catene, Piazza del Mercato - Marghera",2018-12-08,23:00,2019-01-12,23:00
13812,2156,"Natale 2018 a Mestre, in Piazza Ferretto",Piazza Ferretto,2018-12-01,15:30,2019-01-06,15:30
13811,"131, 3198, 37, 3716, 231, 13683",Domenicalmuseo,"Gallerie dell'Accademia, Galleria Giorgio Franchetti alla Ca' d'Oro, Museo d'Arte Orientale, Museo Archeologico Nazionale di Altino, Palazzo Grimani, Villa Pisani",2018-12-01,23:00,2018-12-01,23:00
13810,15,Il giovane Carlo Scarpa,Fondazione Querini Stampalia,2018-11-28,15:00,2018-11-28,15:00
13809,15,Venezia in festa,Fondazione Querini Stampalia,2018-12-05,17:00,2018-12-05,17:00
13807,19,Novembre all'Ateneo Veneto,"Ateneo Veneto di Scienze, Lettere ed Arti",2018-11-27,16:00,2018-12-02,10:00
13806,19,ASPETTANDO il PREMIO VENEZIA …,"Ateneo Veneto di Scienze, Lettere ed Arti",2018-11-30,19:00,2018-11-30,19:00
13805,2463,Professione Food Writer,La Feltrinelli Librerie,2018-11-28,17:00,2018-11-28,17:00
13804,147,Luca Carboni - SPUTNIK TOUR,Cinema Teatro Corso,2019-03-09,20:00,2019-03-09,20:00
13803,9024,Art/Beat: from the Beat Generation to Contemporary Art,Hotel Danieli,2018-12-11,18:30,2018-12-11,18:30
13802,36,"""Bonvià! La piccola grande Odissea di Timul""",Teatro Stabile del Veneto Carlo Goldoni,2018-11-25,15:00,2018-11-25,15:00
13801,364,2 SOLO,Al Vapore,2018-11-22,20:00,2018-11-22,20:00
13800,364,Hot Groove Dancin' Party,Al Vapore,2018-11-24,20:00,2018-11-24,20:00
13799,364,Roberto Gatto Quartet,Al Vapore,2018-11-23,20:00,2018-11-23,20:00
13798,364,Filippo Vignato Trio + Marta Raviglia,Al Vapore,2018-11-30,20:00,2018-11-30,20:00
13797,364, Rolling Carpets,Al Vapore,2018-11-25,20:00,2018-11-25,20:00
13796,139, Lillo e Greg in “Gagmen”,Teatro Toniolo,2018-11-30,20:00,2018-12-01,20:00
13795,134,"TERESINA, UNA STORIA VERA",Ca' Pesaro,2018-11-22,16:00,2018-11-22,16:00
13794,147,IL MITO DEGLI ABBA RIVIVE CON IL TRIBUTE SHOW DEGLI ABBADREAM,Cinema Teatro Corso,2018-11-30,20:15,2018-11-30,20:15
13793,138,Aspettando Venezia Photo,Fontego dei Tedeschi,2018-11-22,18:00,2018-11-22,18:00
13792,35,KEN VANDERMARK & PAAL NILSSEN-LOVE,Palazzo Grassi,2018-11-29,20:00,2018-11-29,20:00
13791,2156,Happy Black Friday,Piazza Ferretto,2018-11-23,9:00,2018-11-23,9:00
13790,2773,Il Giardino ritrovato,Parco di Via Torre Belfredo,2018-11-21,9:00,2018-11-24,9:00
13788,19,L'Ateneo per la Salute,"Ateneo Veneto di Scienze, Lettere ed Arti",2018-11-21,16:00,2018-11-21,19:00
13785,2,Concerto del miglior diplomato dell'anno,"Conservatorio di Musica ""Benedetto Marcello""",2018-11-19,17:00,2018-11-19,17:00
13784,11,“SIC TRANSIT GLORIA MUNDI”,Teatro a l'Avogaria,2018-11-20,20:00,2018-11-20,20:00
13781,27,Come la magia,Teatro Malibran,2018-11-24,17:00,2018-11-24,17:00
13780,19,Novembre all'Ateneo Veneto,"Ateneo Veneto di Scienze, Lettere ed Arti",2018-11-19,16:00,2018-11-23,16:30
13779,19,"VENEZIA – L'AQUILA, un ponte culturale di solidarietà ","Ateneo Veneto di Scienze, Lettere ed Arti",2018-11-17,16:00,2018-11-17,16:00
13778,206,“SAMYUKTA” Recital di Danza Indiana Bharatanatyam,Ex convento SS. Cosma e Damiano,2018-11-24,19:30,2018-11-24,19:30
13777,364,FreshenUp presenta: Gianluca Di Ienno Gliders ,Al Vapore,2018-11-17,20:00,2019-02-22,20:00
13776,364,Comunque Lucio - omaggio a Lucio Battisti,Al Vapore,2018-11-18,20:00,2018-11-18,20:00
13775,19,“IMPRESA E …”,"Ateneo Veneto di Scienze, Lettere ed Arti",2018-11-23,16:30,2018-11-23,16:30
13774,36,ERMAL META RADDOPPIA AL TEATRO GOLDONI DI VENEZIA,Teatro Stabile del Veneto Carlo Goldoni,2019-03-11,20:00,2019-03-12,20:00
13773,231, Le musiche dei Grimani,Palazzo Grimani,2018-11-16,16:00,2018-11-16,16:00
13772,11,STAND UP COMEDY- Ugos di Daniele Tinti,Teatro a l'Avogaria,2018-11-24,20:00,2019-05-11,19:00
13771,12559,Dal grano al pane,Fattoria Bio sociale Il Rosmarino,2018-11-17,9:30,2018-11-18,9:00
13769,13770,I corridoi Umanitari',Corte Sanudo -  Sala della Graticola,2018-11-18,16:30,2018-11-18,16:30
13768,19,“RICORDANDO GIAN FRANCO BOTTAZZO…”,"Ateneo Veneto di Scienze, Lettere ed Arti",2018-11-16,16:00,2018-11-16,16:00
13767,2,"BEETHOVEN, I 6 CONCERTI PER PIANOFORTE E ORCHESTRA","Conservatorio di Musica ""Benedetto Marcello""",2018-12-15,19:00,2018-12-15,19:00
13766,2,"BEETHOVEN, I 6 CONCERTI PER PIANOFORTE E ORCHESTRA","Conservatorio di Musica ""Benedetto Marcello""",2018-12-01,19:00,2018-12-01,19:00
13765,2,"Beethoven, i 6 Concerti per pianoforte e orchestra","Conservatorio di Musica ""Benedetto Marcello""",2018-11-17,19:00,2018-11-17,19:00
13764,2,Omaggio a Castelnuovo Tedesco,"Conservatorio di Musica ""Benedetto Marcello""",2018-11-16,17:00,2018-11-16,17:00
13763,1393,Festa di San Martino a Forte Mezzacapo,Forte Mezzacapo,2018-11-08,19:45,2018-11-11,8:30
13762,13761,Mercatino di san Martino,La Piazza - Centro Commerciale,2018-11-09,8:00,2018-11-10,8:00
13760,13759,IL TRADITORE DI VENEZIA. VITA DI MARINO FALIER DOGE,Libreria La Bottega di Manuzio,2018-11-09,17:30,2018-11-09,17:30
13758,19,CORSO DI STORIA DELL'ARTE 2018,"Ateneo Veneto di Scienze, Lettere ed Arti",2018-11-08,16:30,2018-12-19,16:30
13757,282,Palazzo Grassi e la storia delle sue mostre,Teatrino di Palazzo Grassi,2018-11-15,14:00,2018-11-16,9:00
13756,3421,Léon Bakst. Symbol of the Ballets Russes,Palazzo Cini,2018-11-08,15:00,2018-11-15,15:00
13755,9024,Shakespeare in Venice,Hotel Danieli,2018-11-09,18:30,2018-11-09,18:30
13734,364,Remembering Aretha_Chiara Luppi 4tet,Al Vapore,2018-11-09,20:00,2018-11-09,20:00
13733,364,Gaetano Riccobono 4Tet,Al Vapore,2018-11-10,20:00,2018-11-10,20:00
13732,364,Venezia calls Chicago,Al Vapore,2018-11-08,19:30,2018-11-08,19:30
13731,364,The Heatstrokes,Al Vapore,2018-11-11,20:00,2018-11-11,20:00
13730,148,"""Chi cerca suole mai trovar certezza""",Auditorium Santa Margherita,2018-11-27,17:00,2018-11-27,17:00
13729,252,Il tempo e gli stili. Il lungo percorso di Osvaldo Licini,Peggy Guggenheim Collection,2018-11-22,11:30,2018-11-22,14:00
13728,252,Settimana dei veneziani,Peggy Guggenheim Collection,2018-11-15,23:00,2018-11-20,23:00
13727,1476,"«Ecco il mondo» Arrigo Boito, il futuro nel passato e il passato nel futuro",Fondazione Giorgio Cini,2018-11-13,14:00,2018-11-15,13:30
13726,286,Dilettanti di architettura nella Venezia del Cinquecento,Palazzo Loredan,2018-11-30,8:30,2018-11-30,8:30
13725,286,1919-1920. I trattati di pace e l'Europa,Palazzo Loredan,2018-11-15,9:30,2018-11-16,8:00
13723,15,Aver cura della cura,Fondazione Querini Stampalia,2018-11-14,8:30,2018-11-15,8:30
13721,13722,SOUL SPRITZ DUO live,Re Con Dito Bacaro-Pub,2018-11-09,18:00,2018-11-09,18:00
13719,15, Aperitivi Creativi,Fondazione Querini Stampalia,2018-11-07,17:00,2018-11-07,17:00
13718,139,NOTE ITALIANE,Teatro Toniolo,2018-12-18,20:00,2018-12-18,20:00
13717,11,Una notte assai lunga indicibile,Teatro a l'Avogaria,2018-11-13,20:00,2018-11-13,20:00
13715,"143, 9400, 139, 2086, 12784, 284",Mesthriller ,"Centro Culturale Candiani, Libreria Ubik, Teatro Toniolo, Biblioteca Civica di Mestre Villa Erizzo | VEZ, Spinea - Biblioteca Comunale, Teatro Arnaldo Momo",2018-11-05,23:00,2018-11-24,23:00
13714,10571,5°festival internazionale di musica 'San Martino a Natale',Arsenale-Sala Squadratori,2018-11-08,17:00,2018-11-08,17:00
13713,2,Beethoven Autentico: deviazioni dalle vie battute,"Conservatorio di Musica ""Benedetto Marcello""",2018-11-10,13:30,2018-11-10,13:30
13712,2463,Venezia Bizantina di Nicola Bergamo - Presentazione,La Feltrinelli Librerie,2018-11-14,17:00,2018-11-14,17:00
13711,19,Novembre all'Ateneo Veneto,"Ateneo Veneto di Scienze, Lettere ed Arti",2018-11-05,10:00,2018-11-09,16:00
13710,114,GIOVEDI' D'AUTORE ALLA PIETA',Chiesa della Pietà,2018-11-08,17:00,2018-11-29,17:00
13709,134,"Conferenza “ELIO FIORUCCI: ieri, oggi, domani”",Ca' Pesaro,2018-11-14,10:00,2018-11-14,10:00
13708,134, Binari interrotti di Freddy Longo,Ca' Pesaro,2018-11-15,15:30,2018-11-15,15:30
13707,19,CENTENARIO DELLA GRANDE GUERRA,"Ateneo Veneto di Scienze, Lettere ed Arti",2018-11-02,17:02,2018-11-02,17:02
13706,11871,Finissage della mostra “Presente”,Galleria Arte Spazio Tempo,2018-11-10,17:00,2018-11-10,17:00
13705,"32, 146, 143", I Martedì al cinema,"Cinema Multisala Rossini, Cinema Dante, Centro Culturale Candiani",2018-11-05,23:00,2018-11-26,23:00
13704,231,Pulsar Ensemble,Palazzo Grimani,2018-11-09,17:00,2018-11-09,17:00
13703,2,Concerto Claude Debussy nel primo centenario della morte,"Conservatorio di Musica ""Benedetto Marcello""",2018-12-05,17:00,2018-12-05,17:00
13702,2,Concerto Claude Debussy nel primo centenario della morte,"Conservatorio di Musica ""Benedetto Marcello""",2018-12-04,17:00,2018-12-04,17:00
13701,2,Concerto Claude Debussy nel primo centenario della morte,"Conservatorio di Musica ""Benedetto Marcello""",2018-12-03,17:00,2018-12-03,17:00
13700,2,Il Coltellino,"Conservatorio di Musica ""Benedetto Marcello""",2018-11-13,8:00,2018-11-13,8:00
13699,2,Premio Pianistico “Alberto Giol” terza edizione 2018,"Conservatorio di Musica ""Benedetto Marcello""",2018-11-12,17:00,2018-11-12,17:00
13698,2,Concerto dell’Orchestra Giovanile “Amadeus”,"Conservatorio di Musica ""Benedetto Marcello""",2018-11-10,16:00,2018-11-10,16:00
13697,2,Concerto Claude Debussy,"Conservatorio di Musica ""Benedetto Marcello""",2018-11-08,17:00,2018-11-08,17:00
13696,2,Concerto Claude Debussy,"Conservatorio di Musica ""Benedetto Marcello""",2018-11-05,17:00,2018-11-05,17:00
13694,"131, 230, 3716, 3198, 231, 37, 13683",#Domenicalmuseo,"Gallerie dell'Accademia, Museo Archeologico Nazionale, Museo Archeologico Nazionale di Altino, Galleria Giorgio Franchetti alla Ca' d'Oro, Palazzo Grimani, Museo d'Arte Orientale, Villa Pisani",2018-11-04,9:00,2018-11-04,9:00
13692,364,ANTICIPAZIONE - FreshenUp,Al Vapore,2018-11-17,20:00,2018-02-22,20:00
13691,364,Red Hot Chili Crakers,Al Vapore,2018-11-04,20:00,2018-11-04,20:00
13690,364,Imaani Saleem,Al Vapore,2018-11-03,13:30,2018-11-03,20:00
13689,364,The Trusted,Al Vapore,2018-11-02,20:00,2018-11-02,20:00
13688,364,Compari Soda Live,Al Vapore,2018-11-01,20:00,2018-11-01,20:00
13686,147,TEATRO IN CORSO 2018-2019,Cinema Teatro Corso,2018-11-30,20:15,2019-03-23,23:00
13685,7447,Festival Ville Venete 2018,Venezia Città Metropolitana,2018-10-19,22:00,2018-11-29,23:00
13684,13683,Visita guidata a Villa Pisani,Villa Pisani,2018-12-02,13:00,2018-12-02,13:00
13682,231,Cielo e terra,Palazzo Grimani,2018-11-03,16:00,2018-11-03,16:00
13681,11,IL SERVITORE DI DUE PADRONI,Teatro a l'Avogaria,2018-10-31,20:00,2018-11-01,17:00
13679,19,Venezia e il Piave,"Ateneo Veneto di Scienze, Lettere ed Arti",2018-11-03,16:00,2018-11-03,16:00
13678,318,Halloween alla Festa della Birra,Forte Marghera - Parco del Contemporaneo,2018-10-31,17:30,2018-10-31,17:30
13677,318,Songwriters Showcase Nacht,Forte Marghera - Parco del Contemporaneo,2018-10-28,17:30,2018-10-28,17:30
13676,1608,Maratona di letture a sostegno di Mediterranea Saving Humans,Libreria MarcoPolo - Campo S. Margherita,2018-10-27,16:30,2018-10-27,16:30
13675,13643,I Flauti di San Marco,Centro Commerciale Auchan,2018-10-27,15:00,2018-10-27,15:00
13674,288,MATEMATICA E CULTURA 2019,Palazzo Cavalli Franchetti,2019-03-28,23:00,2019-03-30,23:00
13673,33,"Brunori Sas, concerto speciale per il Teatro La Fenice",Teatro La Fenice,2018-12-19,19:00,2018-12-19,19:00
13672,252, Drawing the Guggenheim,Peggy Guggenheim Collection,2018-10-28,10:30,2018-10-28,15:30
13671,19,"CAFÉ CHANTANT: 1915 – 1918 La musica, le poesie, la satira","Ateneo Veneto di Scienze, Lettere ed Arti",2018-11-06,17:00,2018-11-06,17:00
13670,364,Francesco Bearzatti e Federico Casagrande Duo jazz,Al Vapore,2018-10-27,19:00,2018-10-27,19:00
13669,364,AN EVENING WITH RY COODER,Al Vapore,2018-10-26,19:30,2018-10-26,19:30
13668,9565,"Simone Moro, l'uomo degli 8 mila a Nave de Vero",Nave de Vero,2018-10-26,19:00,2018-10-26,19:00
13667,252,Oltre Licini. Conversazioni in mostra,Peggy Guggenheim Collection,2018-10-25,10:30,2018-11-22,11:30
13666,252,Poesia Squisita. Giornata della poesia in museo,Peggy Guggenheim Collection,2018-12-08,9:00,2018-12-08,9:00
13664,282, Visite guidate gratuite,Teatrino di Palazzo Grassi,2018-10-27,13:00,2018-12-22,14:00
13663,35,Steamboat Switzerland,Palazzo Grassi,2018-10-25,19:00,2018-10-25,19:00
13662,282,Myself is Another: Romeo Castellucci,Teatrino di Palazzo Grassi,2018-11-07,17:00,2018-11-07,20:00
13661,282,Ex Novo Musica: Capriccio Diabolico,Teatrino di Palazzo Grassi,2018-12-02,17:00,2018-12-02,17:00
13660,282,Ex Novo Musica: Con leggerezza pensosa,Teatrino di Palazzo Grassi,2018-12-08,17:00,2018-12-08,17:00
13659,282,CRUISING PAVILION - AFTER DARK,Teatrino di Palazzo Grassi,2018-11-22,17:00,2018-11-22,17:00
13658,282,Casa delle Parole - Bugia ,Teatrino di Palazzo Grassi,2018-11-13,17:30,2018-11-13,17:30
13657,282,Palazzo Grassi e la storia delle sue mostre,Teatrino di Palazzo Grassi,2018-11-14,23:00,2018-11-15,23:00
13656,282,Albert Oehlen e la pittura di oggi,Teatrino di Palazzo Grassi,2018-10-24,16:00,2018-10-24,16:00
13655,"1476, 114, 6203, 10571, 3238, 5266, 6202",San Martino a Natale,"Fondazione Giorgio Cini, Chiesa della Pietà, Chiesa San Felice, Arsenale-Sala Squadratori, Ca' Zanardi, Ex Chiesa Santa Chiara , Chiesa Santa Sofia",2018-11-08,17:30,2018-12-22,16:00
13654,36,ERMAL META - Tour nei TEATRI con GNU QUARTET,Teatro Stabile del Veneto Carlo Goldoni,2019-03-12,20:00,2019-03-12,20:00
13653,231,MusicAmuseo - Askari trio,Palazzo Grimani,2018-10-27,17:30,2018-10-27,17:30
13652,13651,Festa della Zucca di Salzano,Salzano,2018-10-19,13:00,2018-11-04,9:00
13650,231,Opera Balletto di Jean Baptiste Lully,Palazzo Grimani,2018-10-26,15:00,2018-10-26,15:00
13649,"2117, 6403, 1595",LEPANTO LA GRAN BATAJA VI° EDIZIONE,"Pescheria di Rialto, Campo San Giacomo di Rialto, Scuola Grande Confraternita Di San Teodoro",2018-10-20,16:00,2018-10-21,9:30
13648,13647,Doppio Malto Marcon presenta il FestivalBeer,Doppio Malto,2018-10-19,20:00,2018-10-31,20:30
13646,"148, 1476",Le musiche e le danze rituali del Malawi,"Auditorium Santa Margherita, Fondazione Giorgio Cini",2018-10-22,15:30,2018-10-23,16:30
13644,13643,Pingo Pongo,Centro Commerciale Auchan,2018-10-21,15:00,2018-11-16,16:00
13641,1476,Giovanni Poli - La scena dell'essenzialità,Fondazione Giorgio Cini,2018-10-25,13:00,2018-10-26,7:30
13639,13642,"L’arbitrato nelle controversie sul diritto d’autore, nel mondo dello spettacolo e dell’arte ",Fondazione La Biennale di Venezia,2018-11-09,15:00,2018-11-10,8:30
13638,"11, 176",LA COMMEDIA DEGLI ZANNI,"Teatro a l'Avogaria, Teatro Ca' Foscari",2018-10-20,18:30,2018-10-27,8:00
13637,318,Continua la Festa della Birra Forte Marghera,Forte Marghera - Parco del Contemporaneo,2018-10-21,9:00,2018-10-21,9:00
13636,364,Magical Mystery Quintet,Al Vapore,2018-10-20,19:00,2018-10-20,19:00
13635,364,Artisan & Babu Project,Al Vapore,2018-10-19,19:00,2018-10-19,19:00
13634,364,The Doors of Jazz,Al Vapore,2018-10-18,19:00,2018-10-18,19:00
13633,364,Note in Libertà per Amnesty International,Al Vapore,2018-10-21,18:00,2018-10-21,18:00
13631,15,"Leggimi una storia con occhi, cuore e voce   ",Fondazione Querini Stampalia,2018-10-26,22:00,2018-10-27,22:00
13630,15,Chartres la luce riscoperta,Fondazione Querini Stampalia,2018-10-26,16:00,2018-10-26,16:00
13629,15, Aperitivi Creativi 2018,Fondazione Querini Stampalia,2018-10-24,16:00,2018-11-07,17:00
13628,"31, 192, 4993",TOP EVENTI - VENEZIA 2019 ,"Piazza San Marco, Bacino di San Marco, Basilica di Santa Maria della Salute",2019-02-16,18:23,2019-10-26,22:00
13627,147,I Promessi Sposi,Cinema Teatro Corso,2018-10-20,14:00,2018-10-20,19:00
13626,1476,Lumière Matière,Fondazione Giorgio Cini,2019-01-15,23:00,2019-01-16,23:00
13625,231,"Noi, donne del Rinascimento I volti segreti della storia",Palazzo Grimani,2018-10-20,17:30,2018-10-21,14:30
13624,19,Tutte le donne del Tintoretto,"Ateneo Veneto di Scienze, Lettere ed Arti",2018-10-17,15:30,2018-10-17,15:30
13622,2156,Happy Friday Mestre - Festa di Halloween,Piazza Ferretto,2018-10-31,17:00,2018-10-31,17:00
13620,13621, Halloween in Escape Room Venice,Escape Room - Mercante di Venezia,2018-10-25,22:00,2018-11-03,23:00
13619,1252,TORCELLO ABITATA - FESTA FINALE,Basilica di Santa Maria Assunta - Torcello,2018-10-14,13:00,2018-10-14,13:00
13618,2085,Trofeo Città di Venezia,Rio di Cannaregio,2018-10-14,8:00,2018-10-14,8:00
13617,134, Felicit-à,Ca' Pesaro,2018-10-27,10:00,2018-10-27,10:00
13616,"134, 37",Giornata del Contemporaneo,"Ca' Pesaro, Museo d'Arte Orientale",2018-10-12,22:00,2018-10-12,22:00
13615,299,"""Storia e curiosità di un canto leggendario e del suo autore""",Sala San Lorenzo,2018-10-27,15:00,2018-10-27,15:00
13614,7447,Fattorie didattiche 2018: un giorno per scoprire la campagna,Venezia Città Metropolitana,2018-10-13,22:00,2018-10-13,22:00
13613,9565,Alex Britti in concerto gratuito a Nave de Vero,Nave de Vero,2018-10-12,19:00,2018-10-12,19:00
13612,364,The Twisters with Alice Violato,Al Vapore,2018-10-12,19:00,2018-10-12,19:00
13611,364,SUB ROSA 4et,Al Vapore,2018-10-13,19:00,2018-10-13,19:00
13610,148,La Voce - Giorgio Agamben,Auditorium Santa Margherita,2018-12-15,13:30,2018-12-15,13:30
13609,148,L'Urlo di Armida,Auditorium Santa Margherita,2018-11-29,17:00,2018-11-29,17:00
13608,148,Mary Halvorson Octet,Auditorium Santa Margherita,2018-11-12,20:00,2018-11-12,20:00
13607,148,The Bad Plus - Never Stop II,Auditorium Santa Margherita,2018-10-14,19:00,2018-10-14,19:00
13606,147,DINOSAURI “VIVI” ,Cinema Teatro Corso,2018-10-28,15:30,2018-10-28,15:30
13605,147,A NIGHT IN KINSHASA,Cinema Teatro Corso,2018-10-27,19:00,2018-10-27,19:00
13603,5863,Rassegna dedicata a Luciano Emmer,"Istituto Veneto di Scienze, Lettere ed Arti",2018-10-12,15:00,2018-10-12,15:00
13602,231,Giornata Nazionale delle Famiglie al Museo,Palazzo Grimani,2018-10-14,8:30,2018-10-14,8:30
13601,318, Festa della Birra 2018 a Forte Marghera,Forte Marghera - Parco del Contemporaneo,2018-10-12,19:00,2018-10-21,19:00
13599,11,TEATRO AVOGARIA DI VENEZIA,Teatro a l'Avogaria,2018-10-13,14:00,2018-10-13,14:00
13598,134,FIORUCCILAND – Giornata di studi,Ca' Pesaro,2018-10-23,9:00,2018-10-23,9:00
13597,216,Tra arte e architettura. Dialogo con Mark Wigley,IUAV Cotonificio Veneziano,2018-10-11,14:30,2018-10-11,14:30
13596,1179,Pellestrina Plastic Free,Isola di Pellestrina,2018-10-13,8:00,2018-10-13,8:00
13593,2,Concerto del pianista Markus Becker,"Conservatorio di Musica ""Benedetto Marcello""",2018-10-24,15:30,2018-10-24,15:30
13592,139,Churchill,Teatro Toniolo,2019-02-27,18:30,2019-02-28,20:00
13591,139,La notte poco prima delle foreste,Teatro Toniolo,2019-02-19,20:00,2019-02-24,15:30
13590,139,L'importanza di chiamarsi Ernesto,Teatro Toniolo,2019-04-04,19:00,2019-04-07,14:30
13589,139,Sogno di una notte di mezza estate,Teatro Toniolo,2019-03-22,20:00,2019-03-24,15:30
13588,139,Le signorine,Teatro Toniolo,2019-02-15,20:00,2019-02-17,15:30
13587,139,Nel tempo degli dei. Il calzolaio di Ulisse,Teatro Toniolo,2019-03-06,18:30,2019-03-10,15:30
13586,139,Dr. Nest,Teatro Toniolo,2019-03-13,18:30,2019-03-14,20:00
13585,139,Si nota all'imbrunire (Solitudine da paese spopolato),Teatro Toniolo,2019-04-12,19:00,2019-04-14,14:30
13584,143,Note in quinta – CandianiGroove,Centro Culturale Candiani,2018-10-28,17:00,2018-10-28,17:00
13583,143,47 Soul – CandianiGroove,Centro Culturale Candiani,2018-10-19,19:00,2018-10-19,19:00
13582,27,PINOCCHIO – IL MUSICAL,Teatro Malibran,2018-10-13,15:00,2018-10-13,15:00
13581,1309,Recital per pianoforte,Palazzo Cavagnis,2018-10-13,16:00,2018-10-13,16:00
13580,200,Crispian Steele-Perkins e l’Rbs Europa Choir in concerto,Chiesa di San Trovaso,2018-10-13,18:45,2018-10-13,18:45
13579,148,La Stagione 2018 di musicaƒoscari,Auditorium Santa Margherita,2018-10-14,19:00,2018-12-15,13:30
13578,3421,Léon Bakst. Symbol of the Ballets Russes,Palazzo Cini,2018-10-11,14:00,2018-11-15,15:00
13577,38,Jan Vermeire - Festival Internazionale di Venezia,Chiesa di San Moisè,2018-12-01,14:30,2018-12-01,14:30
13576,38,"Rosana Orsini, Marco Brescia - Festival Internazionale di Venezia",Chiesa di San Moisè,2018-11-02,14:30,2018-11-02,14:30
13575,139,Don Chisciotte,Teatro Toniolo,2019-02-06,18:30,2019-02-10,15:30
13574,139,Non mi hai più detto ti amo,Teatro Toniolo,2019-01-16,18:30,2019-01-20,15:30
13573,139,The deep blue sea,Teatro Toniolo,2018-12-12,18:30,2018-12-16,15:30
13572,139,Aeros,Teatro Toniolo,2018-11-27,20:00,2018-11-28,18:30
13571,139,"Miss Marple, giochi di prestigio",Teatro Toniolo,2018-11-21,18:30,2018-11-25,15:30
13570,139,Sei personaggi in cerca d'autore,Teatro Toniolo,2018-11-07,18:30,2018-11-11,15:30
13569,139,IO SONO TEATRO - Programma,Teatro Toniolo,2018-11-07,18:30,2018-04-14,14:30
13568,"13058, 1184, 1252","Tour delle isole di Murano, Burano e Torcello","Faro di Murano, Isola di Burano, Basilica di Santa Maria Assunta - Torcello",2018-10-08,22:00,2018-11-29,23:00
13567,"138, 36, 2627, 114, 12001, 181, 33, 1459",Venezia Jazz Festival,"Fontego dei Tedeschi, Teatro Stabile del Veneto Carlo Goldoni, Hotel Ca' Sagredo, Chiesa della Pietà, Auditorium 'Lo Squero', Isola di San Servolo, Teatro La Fenice, Splendid Venice Hotel",2018-10-18,17:00,2018-11-13,20:00
13565,4993,La festa della Madonna della Salute,Basilica di Santa Maria della Salute,2018-11-20,23:00,2018-11-20,23:00
13564,1393,La Grande Guerra- Una feroce Primavera ,Forte Mezzacapo,2018-10-07,15:30,2018-10-07,15:30
13563,364,"Adios Ferraris! ft. Minimal Klezmer & Friedrich Micio klezmer, jazz, folk",Al Vapore,2018-10-06,19:00,2018-10-06,19:00
13562,364,La Semicroma scuola di musica,Al Vapore,2018-10-07,19:00,2018-10-07,19:00
13561,364,Joselin St.Aimee,Al Vapore,2018-10-05,19:00,2018-10-05,19:00
13558,252,Famiglie al museo,Peggy Guggenheim Collection,2018-10-12,22:00,2018-10-13,22:00
13557,148,Guggenheim Art Classes 2018,Auditorium Santa Margherita,2018-10-08,17:00,2018-12-10,18:00
13556,252,Laboratorio dell’ “Intenzionalità impertinente”,Peggy Guggenheim Collection,2018-10-06,13:00,2018-10-06,13:00
13555,5661,Giornate FAI d'Autunno ,FAI - Negozio Olivetti,2018-10-12,22:00,2018-10-13,22:00
